id,institutionCode,collectionCode,ownerInstitutionCode,basisOfRecord,occurrenceID,catalogNumber,otherCatalogNumbers,kingdom,phylum,class,order,family,scientificName,taxonID,scientificNameAuthorship,genus,specificEpithet,taxonRank,infraspecificEpithet,recordedBy,associatedCollectors,eventDate,year,month,day,startDayOfYear,endDayOfYear,verbatimEventDate,occurrenceRemarks,habitat,substrate,verbatimAttributes,fieldNumber,informationWithheld,dataGeneralizations,dynamicProperties,associatedTaxa,reproductiveCondition,establishmentMeans,cultivationStatus,lifeStage,sex,individualCount,preparations,country,stateProvince,county,municipality,locality,locationRemarks,localitySecurity,localitySecurityReason,decimalLatitude,decimalLongitude,geodeticDatum,coordinateUncertaintyInMeters,verbatimCoordinates,georeferencedBy,georeferenceProtocol,georeferenceSources,georeferenceVerificationStatus,georeferenceRemarks,minimumElevationInMeters,maximumElevationInMeters,minimumDepthInMeters,maximumDepthInMeters,verbatimDepth,verbatimElevation,disposition,language,recordEnteredBy,modified,sourcePrimaryKey_dbpk,collId,recordId,references
3219838,UCJEPS,,,PreservedSpecimen,38102a13-d1a6-4920-9b7d-fc857198d0ca,UC10002,,Plantae,Tracheophyta,Magnoliopsida,Ranunculales,Papaveraceae,Eschscholzia californica,18097,Cham.,Eschscholzia,californica,,,Miss Grace Selby,,1899-01-01,1899,1,1,1,365,1899,"county supplied by Wetherwax; Date as ""1899",,,,,,,,,Flowering/Fruiting,,,,,,,United States,California,Solano,,Benecia [Benicia],,0,,38.0554,-122.1312,WGS84,1223,,UCDavis E,,GoogleMaps via BerkeleyMapper,,georef from old CCH cumulative file; (copied from GH341451),,,,,,,,,,5/30/12 20:59,38102a13-d1a6-4920-9b7d-fc857198d0ca,46,urn:uuid:473272e3-8fa0-4ecc-a298-006637e3de15,http://cch2.org/portal/collections/individual/index.php?occid=3219838
3231977,UCJEPS,,,PreservedSpecimen,3b4a81d2-97bd-405f-a867-e9df35f8bac6,UC10008,,Plantae,Tracheophyta,Magnoliopsida,Ranunculales,Papaveraceae,Eschscholzia californica,18097,Cham.,Eschscholzia,californica,,,F. T. Bioletti,,1891-01-01,1891,1,1,1,365,1891,"Date as ""1891",,,,,,,,,Flowering/Fruiting,,,,,,,United States,California,San Francisco,,San Francisco,,0,,37.775,-122.41833,,,,,,,,,,,,,,,,,,5/30/12 20:59,3b4a81d2-97bd-405f-a867-e9df35f8bac6,46,urn:uuid:53ad8aed-70da-48ae-a04d-33689d6752f4,http://cch2.org/portal/collections/individual/index.php?occid=3231977
3250745,UCJEPS,,,PreservedSpecimen,13c3da2b-4cc0-4016-a30f-248584efefad,UC9994,,Plantae,Tracheophyta,Magnoliopsida,Ranunculales,Papaveraceae,Eschscholzia californica,18097,Cham.,Eschscholzia,californica,,,Carl Purdy,,1897-01-01,1897,1,1,1,,Jan 1 1897,"Rec'd 1897"", no collection date given",,,,,,,,,Flowering/Fruiting,,,,,,,United States,California,Mendocino,,near Ukiah,,0,,39.144787,-123.2056,NAD27,11278,,,,Terrain Navigator (inferred),,(inferred),,,,,,,,,,5/31/12 23:45,13c3da2b-4cc0-4016-a30f-248584efefad,46,urn:uuid:9ccaa6eb-8723-4e1f-92a1-4e40192b2fb1,http://cch2.org/portal/collections/individual/index.php?occid=3250745
3317663,UCJEPS,,,PreservedSpecimen,c3d93a59-2dca-4287-84d8-f374ffe9b194,UC10061,,Plantae,Tracheophyta,Magnoliopsida,Ranunculales,Papaveraceae,Eschscholzia californica,18097,Cham.,Eschscholzia,californica,,,G. W. Dunn,,1891-01-01,1891,1,1,1,365,1891,"Date as ""1891",,,,,,,,,Flowering/Fruiting,,,,,,,United States,California,San Diego,,San Diego,,0,,32.73409,-117.12945,WGS84,9654,,San Diego NHM A,,TOPO! and personal research,,georef from 2006-2015 archive backup file; Tue Sep 3 16:06:22 2013; (copied from UC101054),,,,,,,,,,5/30/12 20:59,c3d93a59-2dca-4287-84d8-f374ffe9b194,46,urn:uuid:c6503faa-08a9-4391-bd7b-6e29db0ae610,http://cch2.org/portal/collections/individual/index.php?occid=3317663
3327086,UCJEPS,,,PreservedSpecimen,9f7e84a4-ed44-40ad-9db5-c7f7565b46df,JEPS51735,,Plantae,Tracheophyta,Magnoliopsida,Ranunculales,Papaveraceae,Eschscholzia californica,18097,Cham.,Eschscholzia,californica,,,Dr. L. M. Newlon,,1/1/21,1921,1,1,1,365,1921,"Date as ""1921",sea shore,,,,,,,,Flowering/Fruiting,,,,,,,United States,California,San Mateo,,sea shore from Salada to Mussel,,0,,37.646,-122.4934,WGS84,1023,,,,GoogleMaps via BerkeleyMapper,,,,,,,,,,,,5/29/12 16:28,9f7e84a4-ed44-40ad-9db5-c7f7565b46df,46,urn:uuid:21aaca58-f231-44a0-96cc-4ce49746c0a0,http://cch2.org/portal/collections/individual/index.php?occid=3327086
3359947,UCJEPS,,,PreservedSpecimen,2f8c492c-e9ff-480e-8b21-78a4432e7329,UC85521,,Plantae,Tracheophyta,Magnoliopsida,Ranunculales,Papaveraceae,Eschscholzia leptomitra,247632,Greene,Eschscholzia,leptomitra,,,Bingham,,1886-01-01,1886,1,1,1,365,1886,,,,,,,,,,,,,,,,,United States,California,Santa Barbara,,Santa Barbara,,0,,34.4208,-119.6972,NAD83,7000,,Santa Barbara Botanic Garden A,,GEOLocate,,georef from 2006-2015 archive backup file; Mon Apr 28 17:54:35 2014; (copied from SBBG70340),,,,,,,,,,5/31/12 22:51,2f8c492c-e9ff-480e-8b21-78a4432e7329,46,urn:uuid:e99f8a63-41fb-418c-96b3-62d35327bf19,http://cch2.org/portal/collections/individual/index.php?occid=3359947
3378408,UCJEPS,,,PreservedSpecimen,7ff6a15a-3a8d-4602-a98c-aec21fc32932,UC10016,,Plantae,Tracheophyta,Magnoliopsida,Ranunculales,Papaveraceae,Eschscholzia californica,18097,Cham.,Eschscholzia,californica,,,Mr. P. B. Westerman,,1898-01-01,1898,1,1,1,,Jan 1 1898,"Received from Mr. P. B. Westerman, 1898",,,,,,,,,Flowering/Fruiting,,,,,,,United States,California,Mendocino,,Round Valley,,0,,39.78802,-123.238846,NAD27,6647,,,,Terrain Navigator (inferred),,(inferred),,,,,,,,,,5/30/12 20:59,7ff6a15a-3a8d-4602-a98c-aec21fc32932,46,urn:uuid:5137a5fd-a296-4bdb-9a9e-5c02a94a7b70,http://cch2.org/portal/collections/individual/index.php?occid=3378408
3379198,UCJEPS,,,PreservedSpecimen,cd2abd16-ac8b-4528-97af-f93c51b0ce75,UC112924,,Plantae,Tracheophyta,Magnoliopsida,Ranunculales,Papaveraceae,Eschscholzia californica,18097,Cham.,Eschscholzia,californica,,,Katharine Brandegee,,1/1/05,1905,1,1,1,365,1905,"county supplied by Wetherwax; Date as ""1905",,,,,,,,,Flowering/Fruiting,,,,,,,United States,California,Sonoma,,Bodega Head,,0,,38.312739,-123.064749,WGS84,1765,,UCBerkeley B,,GEOLocate,,georef from 2006-2015 archive backup file; Wed Apr 25 09:42:48 2012; (copied from CAS101160),,,,,,,,,,5/30/12 22:09,cd2abd16-ac8b-4528-97af-f93c51b0ce75,46,urn:uuid:935d0a0e-1be7-4a8b-9e0d-4263b2a6de5f,http://cch2.org/portal/collections/individual/index.php?occid=3379198
3394013,UCJEPS,,,PreservedSpecimen,594ae74c-4208-45da-b483-e7904e6060a8,UC204939,,Plantae,Tracheophyta,Magnoliopsida,Ranunculales,Papaveraceae,Eschscholzia californica,18097,Cham.,Eschscholzia,californica,,,Miss M. M. Miles,,1884-01-01,1884,1,1,1,366,1884,"Date as ""1884",,,,,,,,,Flowering/Fruiting,,,,,,,United States,California,Santa Barbara,,Santa Barbara,,0,,,,,,,,,,,,,,,,,,,,,5/31/12 17:12,594ae74c-4208-45da-b483-e7904e6060a8,46,urn:uuid:0c4e325b-17dd-4edf-ac8d-a1a5f2592ecf,http://cch2.org/portal/collections/individual/index.php?occid=3394013
3394356,UCJEPS,,,PreservedSpecimen,f68d7362-4b9a-4767-b978-3d89dcb95756,UC338226,,Plantae,Tracheophyta,Magnoliopsida,Ranunculales,Papaveraceae,Eschscholzia californica,18097,Cham.,Eschscholzia,californica,,,unknown,,1887-01-01,1887,1,1,1,366,1887-1888,"From Lemmon Herbarium, probably collected by Lemmon. Date as ""1887-1888"". No location beyond county.",,,,,,,,,Flowering/Fruiting,,,,,,,United States,California,San Luis Obispo,,,,0,,,,,,,,,,,,,,,,,,,,,5/31/12 17:54,f68d7362-4b9a-4767-b978-3d89dcb95756,46,urn:uuid:7beef879-15bb-4840-8358-234d10cf2800,http://cch2.org/portal/collections/individual/index.php?occid=3394356
3418014,UCJEPS,,,PreservedSpecimen,3e291093-6cef-4d73-a102-a2ddf16f38be,UC185325,,Plantae,Tracheophyta,Magnoliopsida,Ranunculales,Papaveraceae,Eschscholzia californica,18097,Cham.,Eschscholzia,californica,,,Katharine Brandegee,,1/1/12,1912,1,1,1,366,1912,"Date as ""1912",,,,,,,,,Flowering/Fruiting,,,,,,,United States,California,Alameda,,Campus Berkeley,,0,,37.871346,-122.25763,NAD27,978,,,,Terrain Navigator 5.03 1:24000,,,,,,,,,,,,5/31/12 16:25,3e291093-6cef-4d73-a102-a2ddf16f38be,46,urn:uuid:6138067a-4a50-4b02-a6d1-1f85abaca377,http://cch2.org/portal/collections/individual/index.php?occid=3418014
3424541,UCJEPS,,,PreservedSpecimen,8f536a96-9189-4835-b40f-5cf0b2350bda,JEPS51732,,Plantae,Tracheophyta,Magnoliopsida,Ranunculales,Papaveraceae,Eschscholzia californica,18097,Cham.,Eschscholzia,californica,,,Dr. L. M. Newlon,,1/1/21,1921,1,1,1,365,1921,"Date as ""1921",,,,,,,,,Flowering/Fruiting,,,,,,,United States,California,San Mateo,,sea shore from Salada to Mussel,,0,,37.646,-122.4934,WGS84,1000,,,,GoogleMaps via BerkeleyMapper,,,,,,,,,,,,5/29/12 16:28,8f536a96-9189-4835-b40f-5cf0b2350bda,46,urn:uuid:477a8023-2114-43c5-b7db-f3e3cd67d3db,http://cch2.org/portal/collections/individual/index.php?occid=3424541
3425537,UCJEPS,,,PreservedSpecimen,9f9f0f68-9175-4d53-b331-c5749da195b8,JEPS51733,,Plantae,Tracheophyta,Magnoliopsida,Ranunculales,Papaveraceae,Eschscholzia californica,18097,Cham.,Eschscholzia,californica,,,Dr. L. M. Newlon,,1/1/21,1921,1,1,1,365,1921,"Date as ""1921",sea shore,,,,,,,,Flowering/Fruiting,,,,,,,United States,California,San Mateo,,sea shore from Salada to Mussel,,0,,37.646,-122.4934,WGS84,1000,,,,GoogleMaps via BerkeleyMapper,,,,,,,,,,,,5/29/12 20:02,9f9f0f68-9175-4d53-b331-c5749da195b8,46,urn:uuid:05e18a64-c99e-4d1b-9caf-5967d2542b50,http://cch2.org/portal/collections/individual/index.php?occid=3425537
3437109,UCJEPS,,,PreservedSpecimen,29cbb371-bad7-40e7-a04f-0dae121ff75e,JEPS51734,,Plantae,Tracheophyta,Magnoliopsida,Ranunculales,Papaveraceae,Eschscholzia californica,18097,Cham.,Eschscholzia,californica,,,Dr. L. M. Newlon,,1/1/21,1921,1,1,1,365,1921,"Date as ""1921",sea shore,,,,,,,,Flowering/Fruiting,,,,,,,United States,California,San Mateo,,sea shore from Salada to Mussel,,0,,37.646,-122.4934,WGS84,1000,,,,GoogleMaps via BerkeleyMapper,,,,,,,,,,,,5/30/12 9:06,29cbb371-bad7-40e7-a04f-0dae121ff75e,46,urn:uuid:a2d89dfa-c8ac-4d48-b175-bcc67426a1b9,http://cch2.org/portal/collections/individual/index.php?occid=3437109
3476399,UCJEPS,,,PreservedSpecimen,d5f6d964-cf2c-4d4c-9610-6e5dd090713f,UC10001,,Plantae,Tracheophyta,Magnoliopsida,Ranunculales,Papaveraceae,Eschscholzia californica,18097,Cham.,Eschscholzia,californica,,,H. P. Chandler,,1899-01-01,1899,1,1,1,365,1899,"county supplied by Wetherwax; Date as ""1899",,,,,,,,,Flowering/Fruiting,,,,,,,United States,California,Alameda,,North Berkeley,,0,,,,,,,,,,,,,,,,,,,,,5/30/12 20:59,d5f6d964-cf2c-4d4c-9610-6e5dd090713f,46,urn:uuid:8104e2db-661e-442b-8fc8-5df9a2b223d8,http://cch2.org/portal/collections/individual/index.php?occid=3476399
3476450,UCJEPS,,,PreservedSpecimen,f5f5719d-eab5-4d2d-843b-a3a3654c5332,UC10003,,Plantae,Tracheophyta,Magnoliopsida,Ranunculales,Papaveraceae,Eschscholzia californica,18097,Cham.,Eschscholzia,californica,,,Miss Abrahamson,,1899-01-01,1899,1,1,1,365,1899,"Date as ""1899",,,,,,,,,Flowering/Fruiting,,,,,,,United States,California,Alameda,,Berkeley,,0,,37.87167,-122.27167,,,,,,,,,,,,,,,,,,5/30/12 20:59,f5f5719d-eab5-4d2d-843b-a3a3654c5332,46,urn:uuid:0261cb29-000c-465e-ae8a-103617b41cce,http://cch2.org/portal/collections/individual/index.php?occid=3476450
3535578,UCJEPS,,,PreservedSpecimen,b0300903-f0be-42ea-b390-204b95374309,JEPS51795,,Plantae,Tracheophyta,Magnoliopsida,Ranunculales,Papaveraceae,Eschscholzia californica,18097,Cham.,Eschscholzia,californica,,,Willis L. Jepson,,1891-01-01,1891,1,1,1,365,1891,"Date as ""1891"". No location beyond county",,,,,,,,,Flowering/Fruiting,,,,,,,United States,California,Marin,,,,0,,,,,,,,,,,,,,,,,,,,,11/26/19 14:54,b0300903-f0be-42ea-b390-204b95374309,46,urn:uuid:ed70a4c6-a570-4484-bb5c-7ae7b2f3eb73,http://cch2.org/portal/collections/individual/index.php?occid=3535578
39663,SBBG,,,PreservedSpecimen,0dd71eda-4483-4f2f-bc40-097c5ec92dbf,SBBG167378,34363,Plantae,Tracheophyta,Magnoliopsida,Ranunculales,Papaveraceae,Eschscholzia californica,18097,Cham.,Eschscholzia,californica,,,R. N. Philbrick,,1/5/66,1966,1,5,5,,1/5/66,,,,,,,,,,Flowers Present,,,,,,,United States,California,Santa Barbara,,"San Miguel Island: upper Canada del Mar, near Nidever adobe",,0,,34.0438,-120.3511,NAD27,1000,,dwilken,,MyTopo,,,,,,,,,,,,9/25/18 1:01,,16,urn:uuid:57b41775-b01b-4e22-9c18-253aeef521ef,http://cch2.org/portal/collections/individual/index.php?occid=39663
3051872,CDA,,,PreservedSpecimen,f846f11c-7eae-4af9-8e3f-23148a2dac64,CDA20837,,Plantae,Tracheophyta,Magnoliopsida,Ranunculales,Papaveraceae,Eschscholzia californica,18097,Cham.,Eschscholzia,californica,,,Anon.,,1/6/09,1909,1,6,6,,1/6/09,USGS quad: M ;,,,,,,,,,,,,,,,,United States,California,Santa Barbara,,South Central Coast; Vicinity of Santa Maria Union High School.,,0,,34.9425,-120.435833,,,"34.942500, -120.435833",,,DMS conversion by CCH loading script,,,,,,,,,,,,5/21/19 17:50,,50,urn:uuid:f846f11c-7eae-4af9-8e3f-23148a2dac64,http://cch2.org/portal/collections/individual/index.php?occid=3051872
519307,SD,,,PreservedSpecimen,{35CCBD7C-F596-4308-B073-32B03E3F2EF3},SD00031822,SD199324,Plantae,Tracheophyta,Magnoliopsida,Ranunculales,Papaveraceae,Eschscholzia californica,18097,Cham.,Eschscholzia,californica,,,Dick Schwenkmeyer,,1/9/08,2008,1,9,9,,9-Jan-08,,,,"Annual; 12 in. high, low and spreading; leaves dissected; flowers cup-shaped, 4 petals, orange color.",,,,,,FL,,,,,,,United States,California,San Diego,,"Mission Trails Regional Park, east of Tierrasanta, approx. 1/4 mile west of North Fortuna summit in Suycott Canyon and approx. 1 mile south of Highway 52",,0,,32.83943,-117.06777,WGS84,,,n/a,,Coordinates from label,,,198,,,,,,,,,1/15/20 10:58,SD199324,43,urn:uuid:38145337-e9e0-447e-824c-be311ca439c1,http://cch2.org/portal/collections/individual/index.php?occid=519307
183112,OBI,,,PreservedSpecimen,6845a680-f443-4c53-b74b-acda8d7a8b69,OBI103866,42251,Plantae,Tracheophyta,Magnoliopsida,Ranunculales,Papaveraceae,Eschscholzia californica,18097,Cham.,Eschscholzia,californica,,,Dan Harrington,,1/15/84,1984,1,15,15,,15-Jan-84,,"Grassy, rocky, soil",,"Annual with orange fls, sepals caduous",,,,,,,,,,,,,United States,California,Monterey,,"Los Padres Natl Forest, 22 mi N of San Simeon. Spruce Crk Trl",,0,,,,,,,,,,,,,,,,,,,,,7/18/13 0:00,,12,urn:uuid:6bb433db-84d8-4362-82fc-e493b41b296f,http://cch2.org/portal/collections/individual/index.php?occid=183112
1976309,SD,,,PreservedSpecimen,{D516CDAC-60CC-4220-A74A-A3E9809DB6F2},SD00032215,SD84425,Plantae,Tracheophyta,Magnoliopsida,Ranunculales,Papaveraceae,Eschscholzia californica,18097,Cham.,Eschscholzia,californica,,,Reid Moran,,1/15/73,1973,1,15,15,,15-Jan-73,,rocky bottom of arroyo,,"Corolla yellow above, orange below",,,,,,FFL,,,,,,,Mexico,Baja California,Unknown,,bottom of Arroyo Socorro 8 miles friom the mouth,,0,,30.33401,-115.68423,WGS84,,,n/a,,Coordinates from label,,,150,,,,,,,,,1/15/20 10:58,SD84425,43,urn:uuid:aa7bb6d2-c79a-4869-a92d-0132b4c0ae98,http://cch2.org/portal/collections/individual/index.php?occid=1976309
1180199,RSA,RSA,,PreservedSpecimen,de910494-a57a-4cbc-b051-ea9d20d36376,,670925,Plantae,Tracheophyta,Magnoliopsida,Ranunculales,Papaveraceae,Eschscholzia californica,18097,Cham.,Eschscholzia,californica,,,Joseph M. Keefe,,1/19/01,2001,1,19,19,,1/19/01,,Chaparral/Oak woodland,,,,,,,,,,,vegetative,,,Herbarium sheet - 1,United States,California,Los Angeles County,,"North side of wood fence along the Eagle Rock Park path between Scholl Canyon Road and Eagle Rock View Drive, 5 meters west of beginning of private driveway with mailboxes (5475 Eagle Rock View Drive); Eagle Rock District, Los Angeles, 90041.",,0,,34.1435,-118.1841944,,,,,,,,,293,,,,,,,,,9/21/18 11:35,18644845,17,urn:uuid:758353de-2820-4a12-925d-5f0acdb86595,http://cch2.org/portal/collections/individual/index.php?occid=1180199
519222,SD,,,PreservedSpecimen,{7D8C50DF-9AD0-44AE-B083-D39DE4D25C5F},SD00031825,SD176596,Plantae,Tracheophyta,Magnoliopsida,Ranunculales,Papaveraceae,Eschscholzia californica,18097,Cham.,Eschscholzia,californica,,,Jeremy Buegge,,1/22/05,2005,1,22,22,,22-Jan-05,,West slope. Reddish soil. 25% slope.,,Common in area. Annual to 40cm tall.,,,,,"Disturbed coastal sage scrub. Upper slope overrun by Brassica. Other spp: Artemesia californica, Malosma laurina, Eriogonum fasciculatum, Cryptantha, Brassica",FFL,,,,,,,United States,California,San Diego,,"Lake Hodges, S of Escondido. SE section of lake, 0.5 mi SE of summit of Bernardo Mtn, 0.5 mi W of I-15. Very near high-water mark (lake recently filled).",,0,,33.0527,-117.0829,WGS84,,,n/a,,Coordinates from label,,,146,,,,,,,,,1/15/20 10:58,SD176596,43,urn:uuid:1791a54f-a851-422b-96ca-a303b5f87790,http://cch2.org/portal/collections/individual/index.php?occid=519222
1976410,SD,,,PreservedSpecimen,{850C95E2-E0BF-4B7C-A4FA-DEBE89D1C871},SD00032202,SD246120,Plantae,Tracheophyta,Magnoliopsida,Ranunculales,Papaveraceae,Eschscholzia californica,18097,Cham.,Eschscholzia,californica,,,Sula Vanderplank,"Tomas Murillo Flores, Nacho Chiapa, Trudi Angell, Leslie Pringle and La Mula Mil",1/26/13,2013,1,26,26,,26-Jan-13,,,,,,,,,,FL,,,,,,,Mexico,Baja California,Unknown,,Near Cerro La Sandia. Sierra San Borja.,,0,,28.4174,-113.40683,WGS84,,,n/a,,Coordinates from label,,,871,,,,,,,,,1/15/20 10:58,SD246120,43,urn:uuid:29dd0753-2731-42db-ab71-927524bdc3b4,http://cch2.org/portal/collections/individual/index.php?occid=1976410
98629,SBBG,,,PreservedSpecimen,84968193-e20a-4f81-8abf-0f16b7ac7122,SBBG167337,95351,Plantae,Tracheophyta,Magnoliopsida,Ranunculales,Papaveraceae,Eschscholzia californica,18097,Cham.,Eschscholzia,californica,,,C. Zeeb,,1/28/84,1984,1,28,28,,1/28/84,,"sandy soil, W-facing slope",,,,,,orange fl,,Flowers Present,,,,,,,United States,California,San Luis Obispo,,Los Osos (Morro Bay Kangaroo Rat reserve),,0,,35.30625,-120.8601,WGS84,106,,CalPoly D,,GoogleMaps via BerkeleyMapper (copied from OBI50345),,georef from old CCH cumulative file,,,,,,,,,mguilliams,9/25/18 1:01,,16,urn:uuid:851e8093-3dd3-42c5-813f-81b4e0149c09,http://cch2.org/portal/collections/individual/index.php?occid=98629
763627,RSA,RSA,,PreservedSpecimen,3bbc36a1-1023-44ee-ab05-4925d7b39e8f,,15341,Plantae,Tracheophyta,Magnoliopsida,Ranunculales,Papaveraceae,Eschscholzia californica subsp. californica,42299,Cham.,Eschscholzia,californica,subsp.,californica,Carl B. Wolf,,1/29/27,1927,1,29,29,,1/29/27,,,,,,,,,,,,,flowers & fruits,,,Herbarium sheet - 1,United States,California,San Mateo County,,Near coast between Pescadero and Pebble Beach,,0,,,,,,,,,,,,,,,,,,,,,9/21/18 11:35,18429382,17,urn:uuid:83d27499-a5da-42a9-9037-01af61600ed8,http://cch2.org/portal/collections/individual/index.php?occid=763627
389245,SDSU,,,PreservedSpecimen,6f998666-206d-439b-ba6d-0b50c46a6ed3,14929,SDSU14929,Plantae,Tracheophyta,Magnoliopsida,Ranunculales,Papaveraceae,Eschscholzia californica subsp. californica,42299,Cham.,Eschscholzia,californica,subsp.,californica,"Beauchamp, R. M.",Craig H. Reiser,1/30/87,1987,1,30,30,,1/30/87,,In open areas.,,Orange-flowered annual.,,,,,,,,0,,,,,United States,California,San Diego,,"Juliett. Camp Joseph Pendleton MCB. San Diego County, California. Base Section: 73-87.",73-87 juliett,0,,33.32201,-117.29168,,1609,"33.31667, -117.28333; 33.32° N; 117.29° W",Mary Alice Kessler,,,,9-Dec-09,122,,,,,400ft.,PEND,,preprocessed,10/8/19 14:25,,6,urn:uuid:6f998666-206d-439b-ba6d-0b50c46a6ed3,http://cch2.org/portal/collections/individual/index.php?occid=389245
519200,SD,,,PreservedSpecimen,{A4476DD9-524C-45EB-A8D6-5862927CC65F},SD00031861,SD173828,Plantae,Tracheophyta,Magnoliopsida,Ranunculales,Papaveraceae,Eschscholzia californica,18097,Cham.,Eschscholzia,californica,,,Marsha Hanson,"Annie Ransom, Victoria Marshall",1/31/05,2005,1,31,31,,31-Jan-05,,,,Showy yellow flowers,,,,,"Sage scrub: Artemisia californica, Calandrinia ciliata, Mirabilis laevis, Erodium, sp., Lepidium sp.",FFL,,,,,,,United States,California,San Diego,,"Lake Poway, City of Poway; edge of trail, northeast side of lake",,0,,33.0114,-117.0122,WGS84,,,n/a,,Coordinates from label,,,277,,,,,,,,,1/15/20 10:58,SD173828,43,urn:uuid:236bcc15-7008-4d3c-8e09-6101fe0adccc,http://cch2.org/portal/collections/individual/index.php?occid=519200
519220,SD,,,PreservedSpecimen,{6B8B43E1-EC2A-43D3-9816-26ECEC24D9A6},SD00031839,SD175558,Plantae,Tracheophyta,Magnoliopsida,Ranunculales,Papaveraceae,Eschscholzia californica,18097,Cham.,Eschscholzia,californica,,,Steve Jr. Black,,1/31/06,2006,1,31,31,,31-Jan-06,,Steep slope,,"Orange four petaled blosson on a long (to 14"") green stem. Lacy light green leaves surround the stem.",,,,,,FL,,,,,,,United States,California,San Diego,,"Hollenbeck Canyon Wildlife Area; ca. 4 mi SE of Jamul, ca. ¼ mi NE of intersection of Honey Springs Rd and SR94.",,0,,32.671,-116.8207,WGS84,,,n/a,,Coordinates from label,,,259,,,,,,,,,1/15/20 10:58,SD175558,43,urn:uuid:fc8d9a28-32aa-419b-9ff9-7c96a3833bf8,http://cch2.org/portal/collections/individual/index.php?occid=519220
1976379,SD,,,PreservedSpecimen,{143D07B8-EEFF-4E4D-B930-C199B7C85A5C},SD00032846,SD168672,Plantae,Tracheophyta,Magnoliopsida,Ranunculales,Papaveraceae,Eschscholzia californica subsp. mexicana,207634,(Greene) C. Clark,Eschscholzia,californica,subsp.,mexicana,Wendy C. Hodgson,Dawn Goldman,1/31/01,2001,1,31,31,,31-Jan-01,,,,,,,,,Arizona Upland of Sonoran Desert with Dichelostemma capitatum. Common.,FL,,,,,,,United States,Arizona,Pinal,,"Tonto National Forest, Arizona Trail, south of Picketpost Trailhead and Highway 60, southwest of Picketpost Mountain.",,0,,33.2518,-111.1749,WGS84,,,n/a,,Coordinates from label,,,870,,,,,,,,,1/15/20 10:58,SD168672,43,urn:uuid:ecb92c59-b820-450b-a2cd-0dbeed39549c,http://cch2.org/portal/collections/individual/index.php?occid=1976379
1976386,SD,,,PreservedSpecimen,{5714C45E-9F28-4FAD-85FB-4CDE735634AB},SD00032848,SD190303,Plantae,Tracheophyta,Magnoliopsida,Ranunculales,Papaveraceae,Eschscholzia californica subsp. mexicana,207634,(Greene) C. Clark,Eschscholzia,californica,subsp.,mexicana,Richard S. Felger,Glenn A. McCreedy and Betsy Wirt,1/31/03,2003,1,31,31,,31-Jan-03,,"Bajada, granitic gravelly soil, dissected by sandy washes.",,,,,,,"Associated species: Olneya tesota, Parkinsonia microphylla.",FL,,,,,,,United States,Arizona,Maricopa,,"North Maricopa Mountains, Sonoran Desert National Monument.",,0,,33.06861,-112.48472,WGS84,,,n/a,,Coordinates from label,,,580,,,,,,,,,1/15/20 10:58,SD190303,43,urn:uuid:42e52e6f-a030-404b-916f-b5de35e01f1f,http://cch2.org/portal/collections/individual/index.php?occid=1976386
3550878,UCJEPS,,,PreservedSpecimen,dc21e914-49d5-41e9-b0c5-a7ef7a84c088,UC128837,,Plantae,Tracheophyta,Magnoliopsida,Ranunculales,Papaveraceae,Eschscholzia californica,18097,Cham.,Eschscholzia,californica,,,Miss Harriet A. Walker,,2/1/06,1906,2,1,32,120,"February-April, 1906","Date as ""February-April, 1906",,,,,,,,,Flowering/Fruiting,,,,,,,United States,California,Alameda,,Vicinity of Berkeley,,0,,37.8701,-122.2668,NAD27,4000,,,,(copied from UC127626),,(copied from UC127626),,,,,,,,,,5/31/12 8:20,dc21e914-49d5-41e9-b0c5-a7ef7a84c088,46,urn:uuid:954c0d21-6ece-489a-bf1e-74cd11aac4d8,http://cch2.org/portal/collections/individual/index.php?occid=3550878
518945,SD,,,PreservedSpecimen,{820B9313-8BBE-447D-A2A9-3968E910906B},SD00032923,SD10242,Plantae,Tracheophyta,Magnoliopsida,Ranunculales,Papaveraceae,Eschscholzia californica subsp. peninsularis,,,,,,,Frank F. Gander,,2/2/35,1935,2,2,33,,2-Feb-35,,,,,,,,,,FL,,,,,,,United States,California,San Diego,,Pacific Beach,,0,,32.80427,-117.24817,WGS84,1609,,mak,,TOPO! v3.4.2,,,,,,,,unknownft.,,,,1/15/20 10:56,SD10242,43,urn:uuid:1e819527-abe4-4ecc-a7de-c3169c33c876,http://cch2.org/portal/collections/individual/index.php?occid=518945
739077,RSA,POM,,PreservedSpecimen,3024394a-bd10-484e-98da-7a5b04c8d3c8,RSA0057998,828253,Plantae,Tracheophyta,Magnoliopsida,Ranunculales,Papaveraceae,Eschscholzia californica,18097,Cham.,Eschscholzia,californica,,,"Sula E. Vanderplank, Bart O'Brien, Valentin Arvizu",,2/2/05,2005,2,2,33,,2/2/05,,On lava mounds.,,,,,,,,,,,flowers & fruits,,,Herbarium sheet - 1,Mexico,Baja California,Ensenada,,Greater San Quintin. In the middle of the cindercones and lava rock of the bay.,,0,,30.469,-116.03,,,,,,,,,,,,,,,,,,9/21/18 11:35,18700738,17,urn:uuid:e3a3e40f-3815-476a-b3df-39241e5c9987,http://cch2.org/portal/collections/individual/index.php?occid=739077
519261,SD,,,PreservedSpecimen,{4DE5E6C4-14AC-4B8E-B9C8-BB63D0DF0DDD},SD00031844,SD189814,Plantae,Tracheophyta,Magnoliopsida,Ranunculales,Papaveraceae,Eschscholzia californica,18097,Cham.,Eschscholzia,californica,,,David Woelfel,Beatrice Woelfel,2/3/06,2006,2,3,34,,3-Feb-06,,Alluvium and hills of sedimentary rock,,short annual with bright orange flower,,,,,"riparian, coastal sage scrub.",FL,,,,,,,United States,California,San Diego,,"North of Fallbrook 1.8 mi on Santa Margarita Hiking Trail, near Santa Margarita River N of junction Deluz Road and Sandia Canyon Road.",,0,,33.4029,-117.2499,WGS84,,,n/a,,Coordinates from label,,,101,,,,,,,,,1/15/20 10:58,SD189814,43,urn:uuid:3c8bbacc-4646-47ec-9e4f-98ba33cd835e,http://cch2.org/portal/collections/individual/index.php?occid=519261
183196,OBI,,,PreservedSpecimen,ac35ba90-9740-4f4c-a1f2-0d61c177d06b,OBI103894,6957,Plantae,Tracheophyta,Magnoliopsida,Ranunculales,Papaveraceae,Eschscholzia californica,18097,Cham.,Eschscholzia,californica,,,S. S. Equinoa,,2/4/68,1968,2,4,35,,4-Feb-68,,,,Growing wild,,,,,,,,,,,,,United States,California,San Luis Obispo,,10 mi S of San Luis Obispo in Avila Beach,,0,,35.179975,-120.731842,WGS84,531,,UCBerkeley L,,GeoLocate (copied from UC54817),,georef from old CCH cumulative file,,,,,,,,,preprocessed,7/18/13 0:00,,12,urn:uuid:54621074-bada-4cd5-9f98-efaf7cc0c0b2,http://cch2.org/portal/collections/individual/index.php?occid=183196
519199,SD,,,PreservedSpecimen,{4DAC8A05-444B-43CA-96BF-23EDC2FD12D3},SD00031862,SD173827,Plantae,Tracheophyta,Magnoliopsida,Ranunculales,Papaveraceae,Eschscholzia californica,18097,Cham.,Eschscholzia,californica,,,Barbara Sullivan,Darren Smith,2/4/05,2005,2,4,35,,4-Feb-05,,Sandy clay,,Yellow-orange flower,,,,,Many native wildflowers,FR,,,,,,,United States,California,San Diego,,"City of San Diego, Torrey Pines State Reserve, Guy Fleming Trial, Ocean overlook.",,0,,32.9245,-117.2588,WGS84,,,n/a,,Coordinates from label,,,46,,,,,,,,,1/15/20 10:58,SD173827,43,urn:uuid:506d17b7-8d1b-4583-a450-7f61b33e83d3,http://cch2.org/portal/collections/individual/index.php?occid=519199
519198,SD,,,PreservedSpecimen,{D748FFC2-8963-412D-998F-D7B56F968F92},SD00031863,SD173826,Plantae,Tracheophyta,Magnoliopsida,Ranunculales,Papaveraceae,Eschscholzia californica,18097,Cham.,Eschscholzia,californica,,,Mark A. Elvin,Scott Boczkiewicz,2/5/05,2005,2,5,36,,5-Feb-05,,rocky (granite) clay with scattered clay lenses,,Locally common perennial in S-facing openings; fls. orange with a hint of yellow.,,,,,"Coastal sage scrub with Art. cal., Malasma laurina, Eriog. fasc.",FL,,,,,,,United States,California,San Diego,,"W side of Otay Mtn; 1.5km SSE of Savage Dam (Otay Lake); N of County Prison; near tributary to Otay River, N of ONeal Canyon.",,0,,32.5969,-116.9242,WGS84,,,n/a,,Coordinates from label,,,183,,,,,,,,,1/15/20 10:58,SD173826,43,urn:uuid:7d015299-3bde-48e2-8563-cc733fea528a,http://cch2.org/portal/collections/individual/index.php?occid=519198
634839,IRVC,,,PreservedSpecimen,26481c89-5873-4e66-a2f3-30ed3fc70912,IRVC106052,IRVC27063,Plantae,Tracheophyta,Magnoliopsida,Ranunculales,Papaveraceae,Eschscholzia californica,18097,Cham.,Eschscholzia,californica,,,Mark A. Elvin,Scott Boczkiewicz,2/5/05,2005,2,5,36,,5-Feb-05,,"Coastal sage scrub with Art. cal., Malasma laurina, Eriog. fasc.",,Locally common perennial in S-facing openings; fls. orange with a hint of yellow.,,,,,,Flowering,,,,,,,United States,California,San Diego,,"W side of Otay Mtn; 1.5km SSE of Savage Dam (Otay Lake); N of County Prison; near tributary to Otay River, N of O'Neal Canyon. Rocky (granite) clay with scattered clay lenses; SD Plant Atlas grid V14",,0,,32.5969,-116.9242,,,11S 507117E 3606408N,San Diego NHM A,,(copied from SD165750),,,183,,,,,,,,MAE,5/12/17 0:00,,37,urn:uuid:26481c89-5873-4e66-a2f3-30ed3fc70912,http://cch2.org/portal/collections/individual/index.php?occid=634839
732196,RSA,RSA,,PreservedSpecimen,2cdc8152-09ea-42f1-9765-8fae914fa956,,713069,Plantae,Tracheophyta,Magnoliopsida,Ranunculales,Papaveraceae,Eschscholzia californica,18097,Cham.,Eschscholzia,californica,,,"Mark A. Elvin, Scott Boczkiewicz",,2/5/05,2005,2,5,36,,2/5/05,,"Coastal sage scrub with Art. cal. Malasma laurina, Eriog. fasc.; rocky (granite) clay with scattered clay lenses; SD Plant Atlas grid V14.",,,,,,,,,,,flowers,,,Herbarium sheet - 1,United States,California,San Diego County,,"Peninsular Ranges, San Ysidro Mountains: W side of Otay Mtn; 1.5 km SSE of Savage Dam (Otay Lake); N of County Prison; near tributary to Otay River, N of O'Neal Canyon.",,0,,,,,,,,,,,,183,,,,,,,,,9/21/18 11:35,18683064,17,urn:uuid:38b617e7-59bb-4d6f-b9cc-74f394c98bdf,http://cch2.org/portal/collections/individual/index.php?occid=732196
1572935,UCR,,,PreservedSpecimen,UCR-BPS-152940,UCR0064020,UCR-152940,Plantae,Tracheophyta,Magnoliopsida,Ranunculales,Papaveraceae,Eschscholzia californica,18097,Cham.,Eschscholzia,californica,,,Mark A. Elvin,Scott Boczkiewicz,2/5/05,2005,2,5,36,,2/5/05,Locally common perennial in S-facing openings; fls. orange with a hint of yellow,"Coastal sage scrub with Artemisia californica, Malosma laurina, Eriogonum fasciculatum; rocky (granite) clay with scattered clay lenses; SD Plant Atlas grid V14.",,,,,,,,,,,,,,,United States,California,San Diego,,"W side of Otay Mountains, 1.5 km SSE of Savage Dam (Otay Lake); N of County Prison, near tributary to Otay River, N of O’Neal Canyon",,0,,32.595,-116.92417,,,507117E 3606408N,,,TopoZoneTS,,,183,,,,,,,,,1/19/20 17:49,UCR-BPS-152940,3,urn:uuid:d56c4ab8-fad3-4aa0-be56-5fa599e00d23,http://cch2.org/portal/collections/individual/index.php?occid=1572935
519126,SD,,,PreservedSpecimen,{C9CA3059-3726-4E99-A7DB-5A41F2742A9D},SD00032099,SD139814,Plantae,Tracheophyta,Magnoliopsida,Ranunculales,Papaveraceae,Eschscholzia californica,18097,Cham.,Eschscholzia,californica,,,Christopher Christie,,2/6/97,1997,2,6,37,,6-Feb-97,,Rocky slope with clay loam derived from jurassic/triassic metavolcanic rock,,"Upright and spreading herb, branched from base and along stems. 25-50 cm high by 40-75 cm wide. Stems glabrous, light green with reddish tinge. Lvs. Finely divided, basal and cauline. Flrs. Golden yellow to orange.",,,,,"Cryptantha muricata, Dichelostemma capitatum, Linanthus dianthiflorus, Lepidium densiflorum, Erodium brachycarpum, E. cicutarium",FFL,,,,,,,United States,California,San Diego,,Western Otay Mountain foothills of San Ysidro On rocky slope with clay loam derived from jurassic/triassic metavolcanic rock. 1st year after burn,,0,,32.57441,-116.90937,WGS84,241,,mak,,"TRS Conversion, TOPO! v3.4.2",,,308,,,,,,,,,1/15/20 10:57,SD139814,43,urn:uuid:f3783296-90dd-4360-89bf-a95597ff8bc4,http://cch2.org/portal/collections/individual/index.php?occid=519126
720617,RSA,RSA,,PreservedSpecimen,27593a53-4699-42c1-8c85-44918870ec6d,,615180,Plantae,Tracheophyta,Magnoliopsida,Ranunculales,Papaveraceae,Eschscholzia californica,18097,Cham.,Eschscholzia,californica,,,Christopher Christie,,2/6/97,1997,2,6,37,,2/6/97,,"40% slope, rocky slope with clay loam derived from jurassic/triassic metavolcanic rock, 1st year after burn with...",,,,,,,,,,,flowers & fruits,,,Herbarium sheet - 1,United States,California,San Diego County,,Western Otay Mtn foothills of San Ysidro.,,0,,,,,,,,,,,,308,,,,,,,,,9/21/18 11:35,18645659,17,urn:uuid:edae5420-8506-4bdd-a637-d84fb3c65358,http://cch2.org/portal/collections/individual/index.php?occid=720617
317832,UCSB,,UCSB,PreservedSpecimen,97e26a38-1fa4-49d5-939a-45b018055bd7,UCSB009014,51874,Plantae,Tracheophyta,Magnoliopsida,Ranunculales,Papaveraceae,Eschscholzia californica,18097,Cham.,Eschscholzia,californica,,,"Butts, T.",,2/8/67,1967,2,8,39,,,,"Occasional, with Avena fatua, in field protected by large fence on east side, loamy soil",,,,,,,,,,,,,,Sheet - 1,United States,California,Santa Barbara,,On Ellwood Rd. 75 yards south of its jct. with Hollister Avenue,,0,,,,,,,,,,,,,,,,,,,,,7/3/14 12:35,,35,urn:uuid:88e681ed-966c-45ab-890a-4c93d36cc143,http://cch2.org/portal/collections/individual/index.php?occid=317832
375297,SDSU,,,PreservedSpecimen,fdb3506e-a16d-47ae-90bd-46625a5d8d5c,819,SDSU00819,Plantae,Tracheophyta,Magnoliopsida,Ranunculales,Papaveraceae,Eschscholzia californica subsp. californica,42299,Cham.,Eschscholzia,californica,subsp.,californica,"Gander, F. F.",,2/9/35,1935,2,9,40,,2/9/35,,,,,,,,,,,,0,,,,,United States,California,San Diego,,Hills near Otay.,,0,,32.60009,-116.99949,WGS84,2415,,San Diego NHM D,,TOPO! (copied from SD112390),,georef from 2015-2018 archive backup file; Date Georeferenced: Tue Jun 7 09:42:58 2016,,,,,,,,,preprocessed,10/8/19 14:25,,6,urn:uuid:fdb3506e-a16d-47ae-90bd-46625a5d8d5c,http://cch2.org/portal/collections/individual/index.php?occid=375297
973084,RSA,RSA,,PreservedSpecimen,7bb0047e-94cc-42be-93de-a7e1eba9bfb2,,542456,Plantae,Tracheophyta,Magnoliopsida,Ranunculales,Papaveraceae,Eschscholzia californica,18097,Cham.,Eschscholzia,californica,,,Fred M. Roberts,,2/9/88,1988,2,9,40,,2/9/88,,"Gentle ridge at top of steep, W facing slope in disturbed grassland with Phacelia parryi, Phacelia cicutaria and Bromus rubens in clay soil",,,,,,,,,,,flowers & fruits,,,Herbarium sheet - 1,United States,California,Orange County,,"Lomas De Santiago, Loma Ridge, Upper Hicks canyon rim, 0.7 km N Bee Survey Mark.",,0,,,,,,,,,,,,469,,,,,,,,,9/21/18 11:30,18745552,17,urn:uuid:7517ecc2-a862-4e74-91d7-c327d4a2d611,http://cch2.org/portal/collections/individual/index.php?occid=973084
3611761,SHTC,,,PreservedSpecimen,a5a838a4-5d70-47e3-af59-454974d538a7,,421,Plantae,Tracheophyta,Magnoliopsida,Ranunculales,Papaveraceae,Eschscholzia californica,18097,Cham.,Eschscholzia,californica,,,"Ramirez, V.",,2/9/16,2016,2,9,40,,2/9/16,,near lake,,,,,,"orange flower with four petals, flowers close during cloudy weather",,,,,,,,,United States,California,Stanislaus,,"CSU Stanislaus Campus, Next to Willow Lake, growing near the pathway between Naraghi Hall of Science and the bookstore",,0,,37.523611,-120.856666,,,"37.523611, -120.856666",,,,,,30,,,,,,Y,,,6/25/19 16:18,,69,urn:uuid:a5a838a4-5d70-47e3-af59-454974d538a7,http://cch2.org/portal/collections/individual/index.php?occid=3611761
1117237,RSA,RSA,,PreservedSpecimen,c0799222-91e4-4ec7-95c8-d45e6cecc4e5,,445603,Plantae,Tracheophyta,Magnoliopsida,Ranunculales,Papaveraceae,Eschscholzia californica subsp. californica,42299,Cham.,Eschscholzia,californica,subsp.,californica,Glenn A. Gorelick,,2/10/67,1967,2,10,41,,2/10/67,,,,,,,,,,,,,flowers,,,Herbarium sheet - 1,United States,California,San Mateo County,,"San Bruno Mountains, overlooking Daly City near San Francisco.",,0,,,,,,,,,,,,,,,,,,,,,9/21/18 11:35,18711452,17,urn:uuid:aba9fa32-f056-4a34-a188-2b82e9a20569,http://cch2.org/portal/collections/individual/index.php?occid=1117237
3310317,UCJEPS,,,PreservedSpecimen,9edf77f5-dcf6-4fe9-ac9f-6b8a56935ccb,UC610547,,Plantae,Tracheophyta,Magnoliopsida,Ranunculales,Papaveraceae,Eschscholzia californica,18097,Cham.,Eschscholzia,californica,,,"Edward Lee, Herbert Mason",,2/10/35,1935,2,10,41,,Feb 10 1935,,,,,,,,,,Flowering/Fruiting,,,,,,,United States,California,Monterey,,Whaler's Knoll Point Lobos State Park,,0,,36.52167,-121.94611,NAD27,1783,,UCSanta Cruz H,,Terrain Navigator Pro,,georef from 2006-2015 archive backup file; Thu Mar 7 16:54:44 2013; (copied from UC610600),,,,,,,,,,5/31/12 19:43,9edf77f5-dcf6-4fe9-ac9f-6b8a56935ccb,46,urn:uuid:bd8d65e5-d885-49e6-aa86-5a7c3de2ca2e,http://cch2.org/portal/collections/individual/index.php?occid=3310317
3317263,UCJEPS,,,PreservedSpecimen,06e9df5a-fe51-4830-b68c-e1a7f775727a,JEPS73670,,Plantae,Tracheophyta,Magnoliopsida,Ranunculales,Papaveraceae,Eschscholzia californica,18097,Cham.,Eschscholzia,californica,,,Allison Krames,,2/10/35,1935,2,10,41,,Feb 10 1935,,low hills,,,,,,,,Flowering/Fruiting,,,,,,,United States,California,Kern,,12 mi ne Bakersfield (low hills s of Kern River),,0,,,,,,,,,,,,,,,,,,,,,5/30/12 9:37,06e9df5a-fe51-4830-b68c-e1a7f775727a,46,urn:uuid:5f9364ec-40cc-45d1-a50b-31a2117cd48f,http://cch2.org/portal/collections/individual/index.php?occid=3317263
3426942,UCJEPS,,,PreservedSpecimen,81aa3e11-9656-4cd5-b5a2-ddda291a5ab2,JEPS51721,,Plantae,Tracheophyta,Magnoliopsida,Ranunculales,Papaveraceae,Eschscholzia californica,18097,Cham.,Eschscholzia,californica,,,Allison Krames,,2/10/35,1935,2,10,41,,Feb 10 1935,,low hills,,,,,,,,Flowering/Fruiting,,,,,,,United States,California,Kern,,hills s Kern River (12 mi ne of Bakersfield),,0,,,,,,,,,,,,,,,,,,,,,5/30/12 10:14,81aa3e11-9656-4cd5-b5a2-ddda291a5ab2,46,urn:uuid:589ee1a2-4ce2-4746-9828-b432d655cceb,http://cch2.org/portal/collections/individual/index.php?occid=3426942
117630,SBBG,,,PreservedSpecimen,ab26125b-2fb4-46e2-ba64-24770b8887c2,SBBG169373,21777,Plantae,Tracheophyta,Magnoliopsida,Ranunculales,Papaveraceae,Eschscholzia californica,18097,Cham.,Eschscholzia,californica,,,E. R. Chandler,,2/12/65,1965,2,12,43,,2/12/65,,open grassy slope,,,,,,fls deep orange,,Flowers Present,,,,,,,United States,California,Santa Barbara,,"Santa Ynez Valley: Los Padres National Forest; Happy Cyn Rd, ca. 1 mi beyond the San Ynez River Bridge",,0,,34.601,-120.028,NAD83,1000,,dwilken,,MyTopo,,,,,,,,700 ft,,,,9/25/18 1:01,,16,urn:uuid:e882e23d-1072-4d94-96aa-6b8cf5010059,http://cch2.org/portal/collections/individual/index.php?occid=117630
519227,SD,,,PreservedSpecimen,{814FE4B9-F93D-4AE4-A6B2-0381DBB6623F},SD00031837,SD177063,Plantae,Tracheophyta,Magnoliopsida,Ranunculales,Papaveraceae,Eschscholzia californica,18097,Cham.,Eschscholzia,californica,,,Jerilyn Hirshberg,,2/12/06,2006,2,12,43,,12-Feb-06,,granitic: on steep south-facing slope at edge of Cedar Creek Road,,"annual, 1 dm tall, flowers bright orange",,,,,coastal sage scrub,FFL,,,,,,,United States,California,San Diego,,0.5 mile east of Saddleback parking area and locked gate on Eagle Peak Road,,0,,33.0023,-116.7118,WGS84,,,n/a,,Coordinates from label,,,560,,,,,,,,,1/15/20 10:58,SD177063,43,urn:uuid:f6fb171e-13b8-495d-b549-c1387b5e4c70,http://cch2.org/portal/collections/individual/index.php?occid=519227
519572,SD,,,PreservedSpecimen,{0D5503C3-C70C-4C66-983E-4F9C0A9B6832},SD00032065,SD258178,Plantae,Tracheophyta,Magnoliopsida,Ranunculales,Papaveraceae,Eschscholzia californica,18097,Cham.,Eschscholzia,californica,,,Jerry Green,,2/12/15,2015,2,12,43,,12-Feb-15,,Silty - rocky,,Flowers - yellow with pale orange throat,,,,,,FL,,,,,,,United States,California,San Diego,,Rancho Penasquitos ; along hiking trail near 0.12 Miles NW of intersection Carmel Valley Rd & Black Mountain Rd.,,0,,32.9859,-117.1337,WGS84,,,n/a,,Coordinates from label,,,201,,,,,,,,,1/15/20 10:58,SD258178,43,urn:uuid:7cc7c7bc-cb61-4721-99b6-d6acc3177d33,http://cch2.org/portal/collections/individual/index.php?occid=519572
3278065,UCJEPS,,,PreservedSpecimen,9a5651fa-cd5d-41d2-a960-adcf14cfea82,JEPS46123,,Plantae,Tracheophyta,Magnoliopsida,Ranunculales,Papaveraceae,Eschscholzia californica,18097,Cham.,Eschscholzia,californica,,,Mrs. E. L. Mossman,,2/12/31,1931,2,12,43,,Feb 12 1931,county supplied by Wetherwax,,,,,,,,,Flowering/Fruiting,,,,,,,United States,California,Alameda,,Berkeley Hills,,0,,,,,,,,,,,,,,,,,,,,,5/29/12 16:27,9a5651fa-cd5d-41d2-a960-adcf14cfea82,46,urn:uuid:df43bc09-4f1c-4454-a26f-9ba69f2cbb04,http://cch2.org/portal/collections/individual/index.php?occid=3278065
3461457,UCJEPS,,,PreservedSpecimen,0f544020-548d-4ff4-be7f-7d898486698d,JEPS51799,,Plantae,Tracheophyta,Magnoliopsida,Ranunculales,Papaveraceae,Eschscholzia californica,18097,Cham.,Eschscholzia,californica,,,Frank W. Peirson,,2/12/19,1919,2,12,43,,Feb 12 1919,,,,,,,,,,Flowering/Fruiting,,,,,,,United States,California,Los Angeles,,Arroyo Seco San Gabriel Mts.,,0,,,,,,,,,,,,457,,,,,1500 ft,,,,5/29/12 16:28,0f544020-548d-4ff4-be7f-7d898486698d,46,urn:uuid:c83b3bd3-7517-4c85-83f3-5dc5b7868a13,http://cch2.org/portal/collections/individual/index.php?occid=3461457
235093,UCSC,,,PreservedSpecimen,57d903a0-bfff-4b13-87bd-07edc5edb951,,6522,Plantae,Tracheophyta,Magnoliopsida,Ranunculales,Papaveraceae,Eschscholzia californica,18097,Cham.,Eschscholzia,californica,,,Maya Havusha,,2/13/10,2010,2,13,44,,13-Feb-10,,Abundant around Researchers Cabin on Whale Point,,,,,,,,,,,,,,,United States,California,Monterey,,Whale Point; Landels-Hill Big Creek Reserve,,0,,,,,,,,,,,,,,,,,,BC,,,5/20/16 19:58,,13,urn:uuid:d0c5c861-c9c6-468e-89aa-e2ec5ae9299b,http://cch2.org/portal/collections/individual/index.php?occid=235093
237190,UCSC,,,PreservedSpecimen,2f70fd1f-0df9-4c53-8c2f-78df135c52ab,,8955,Plantae,Tracheophyta,Magnoliopsida,Ranunculales,Papaveraceae,Eschscholzia californica,18097,Cham.,Eschscholzia,californica,,,Michael C. MacDonald,,2/13/15,2015,2,13,44,,13-Feb-15,"Soil type: loam. Topography: sloping meadow, south facing slope. Associated species: Raphanus sativus, Vicia sativa, Plantago lanceolata, Stipa pulchra.",,,,,,,,,,,,,,,,United States,California,Santa Cruz,,"Santa Cruz, UCSC Campus, south of Meyer Drive, past the Recital Hall and fenced in grazing area.",,0,,36.985556,-122.056333,WGS84,,,,,,,,,,,,,,Systematic Botany Course 2022,,Juliet Oshiro,5/20/16 19:58,,13,urn:uuid:130539ef-e174-47b5-b597-15632e213d88,http://cch2.org/portal/collections/individual/index.php?occid=237190
392896,SDSU,,,PreservedSpecimen,637d5f0b-d948-4f92-9949-2e1ab98e66b1,18719,SDSU18719,Plantae,Tracheophyta,Magnoliopsida,Ranunculales,Papaveraceae,Eschscholzia californica subsp. californica,42299,Cham.,Eschscholzia,californica,subsp.,californica,"Guilliams, C. Matt",,2/13/08,2008,2,13,44,,2/13/08,,"Slightly burned Riversidean coastal sage scrub on west-southwest facing slope. Ca. 45 degree slope, soils of decomposed granite and loam.",,"Annual herb, corolla orange. Dominant between shrubs.",,,,,,,,0,,,,,United States,California,Riverside,,"El Sobrante Landfill preserve area, western Riverside County, east of Interstate 15 off Temescal Canyon Road. Ca. 5 kilometers east off freeway. Access through landfill entrance.",,0,,33.79197,-117.46353,,,33.00° 47.00m 31s N; 117.00° 27.00m 49s W,,,Garmin Etrex GPS,,,410,,,,,1344ft.,,,preprocessed,10/8/19 14:25,,6,urn:uuid:637d5f0b-d948-4f92-9949-2e1ab98e66b1,http://cch2.org/portal/collections/individual/index.php?occid=392896
392920,SDSU,,,PreservedSpecimen,a06d05b3-7448-44c0-b433-664a742a9b3b,18743,SDSU18743,Plantae,Tracheophyta,Magnoliopsida,Ranunculales,Papaveraceae,Eschscholzia californica subsp. californica,42299,Cham.,Eschscholzia,californica,subsp.,californica,"Guilliams, C. Matt",,2/13/08,2008,2,13,44,,2/13/08,,"Slightly burned Riversidean coastal sage scrub on west-southwest facing slope. Ca. 45 degree slope, soils of decomposed granite and loam.",,"Annual herb, corolla orange. Dominant between shrubs.",,,,,,,,0,,,,,United States,California,Riverside,,"El Sobrante Landfill preserve area, western Riverside County, east of Interstate 15 off Temescal Canyon Road. Ca. 5 kilometers east off freeway. Access through landfill entrance.",,0,,33.79197,-117.46353,,,33.00° 47.00m 31s N; 117.00° 27.00m 49s W,,,Garmin Etrex GPS,,,410,,,,,1344ft.,,,preprocessed,10/8/19 14:25,,6,urn:uuid:a06d05b3-7448-44c0-b433-664a742a9b3b,http://cch2.org/portal/collections/individual/index.php?occid=392920
20569,LA,,,PreservedSpecimen,1bfc282e-3464-4062-932d-a1f9dbf6b702,,LA212715,Plantae,Tracheophyta,Magnoliopsida,Ranunculales,Papaveraceae,Eschscholzia californica,18097,Cham.,Eschscholzia,californica,,,Carl Epling,WM. Robison,2/14/35,1935,2,14,45,,14-Feb-35,"Deep, reddish yellow.",,,,,,,,,,,,,,,,MEXICO,,,,Baja California Peninsula; 12 mi N of Rosario,,0,,,,,,,,,,,,,,,,,,,,,9/20/18 13:05,,34,urn:uuid:1bfc282e-3464-4062-932d-a1f9dbf6b702,http://cch2.org/portal/collections/individual/index.php?occid=20569
115809,SBBG,,,PreservedSpecimen,a7762f70-e5e1-40f6-8550-5d06e93e0184,SBBG170489,136636,Plantae,Tracheophyta,Magnoliopsida,Ranunculales,Papaveraceae,Eschscholzia californica,18097,Cham.,Eschscholzia,californica,,,"Y. Arami, D. Johnson-May, O. Alladeen, P. Perkins, L. Kurtz, J. Lam",,2/14/16,2016,2,14,45,,2/14/16,relatively abundant,rocky hillside,,,,,,long skinny stem; tiny skiny lvs; bright yellow flowers,,Flowers Present,,,,,,,United States,California,San Luis Obispo,,Prospects Fire Lookout Tower (Bowden Ranch Open Space),,0,,35.2752,-120.6333,unknown,750,,,,Label (GPS),,,,,,,,,,,,9/25/18 1:01,,16,urn:uuid:564edadc-5650-443a-a46c-2c744d02d6a2,http://cch2.org/portal/collections/individual/index.php?occid=115809
183210,OBI,,,PreservedSpecimen,a1b28543-9cf3-4825-851d-ddbd3609d6fe,OBI103916,81023,Plantae,Tracheophyta,Magnoliopsida,Ranunculales,Papaveraceae,Eschscholzia californica,18097,Cham.,Eschscholzia,californica,,,David J. Keil,,2/14/15,2015,2,14,45,,2/14/15,,"Roadside zone in area of coastal live oak woodland, riparian zone, grassy fields, and agricultural disturbance; Common",,Petals orange,,,,,,,,,,,,,United States,California,San Luis Obispo,,Pismo Preserve. Vicinity of intersection of Thousand Hills Road with Price Canyon Road,,0,,35.164279,-120.634685,,,,,,,,,25,,,,,,,,Mara McKown,11/6/15 0:00,,12,urn:uuid:70790e4c-bd51-48da-af7f-ec601409fd66,http://cch2.org/portal/collections/individual/index.php?occid=183210
519161,SD,,,PreservedSpecimen,{9BF66BAA-37A5-4242-AAC4-03AAFBBCDF00},SD00031871,SD163682,Plantae,Tracheophyta,Magnoliopsida,Ranunculales,Papaveraceae,Eschscholzia californica,18097,Cham.,Eschscholzia,californica,,,MaryAnn Brooks-Gonyer,,2/15/05,2005,2,15,46,,15-Feb-05,,"Roadside, disturbed area, sandy soil; west facing hillside soil is clay",,"bright orange cup-shaped flowers, common",,,,,"coastal sage brush, buckwheat, mulefat, grasses, laurel sumac",FL,,,,,,,United States,California,San Diego,,"Approximately 11 miles north of Escondido near Bonsall, intersection of Old Highway 395 and Camino Del Rey, east of I-15",,0,,33.268,-117.1554,WGS84,,,n/a,,Coordinates from label,,,-9999,,,,,,,,,1/15/20 10:57,SD163682,43,urn:uuid:143d2e49-52be-469e-a7db-297117c52697,http://cch2.org/portal/collections/individual/index.php?occid=519161
622721,IRVC,,,PreservedSpecimen,bf0c3343-8f1d-4a27-b928-8ed27bfb7c23,,IRVC22062,Plantae,Tracheophyta,Magnoliopsida,Ranunculales,Papaveraceae,Eschscholzia californica var. peninsularis,47127,(Greene) Munz,Eschscholzia,californica,var.,peninsularis,Fred M. Roberts,,2/15/84,1984,2,15,46,,15-Feb-84,,,,,,,,,,,,,,,,,United States,California,Orange,,"CASPER'S REGIONAL PARK: S rim Lucas Cyn., Rancho Carillo Rd. , 4.2km NE Visitor Center; 0.2km NW Lucas Survey Mark",,0,,,,,,,,,,,,420,,,,,,,,,10/22/18 18:36,,37,urn:uuid:bf0c3343-8f1d-4a27-b928-8ed27bfb7c23,http://cch2.org/portal/collections/individual/index.php?occid=622721
3235722,UCJEPS,,,PreservedSpecimen,7777789f-45d6-4e50-aa5d-e86f15eb0761,UC370451,,Plantae,Tracheophyta,Magnoliopsida,Ranunculales,Papaveraceae,Eschscholzia californica,18097,Cham.,Eschscholzia,californica,,,H. E. Parks,,2/15/29,1929,2,15,46,,Feb 15 1929,,,,flower yellow,,,,,,Flowering/Fruiting,,,,,,,United States,California,San Diego,,La Jolla,,0,,32.8332,-117.25881,WGS84,3218,,San Diego NHM A,,TOPO!,,georef from 2006-2015 archive backup file; Wed Dec 5 12:58:02 2012; (copied from DS93502),76,,,,,250 ft,,,,5/31/12 18:02,7777789f-45d6-4e50-aa5d-e86f15eb0761,46,urn:uuid:2753fca4-d331-458b-97e0-8429dbc9eba7,http://cch2.org/portal/collections/individual/index.php?occid=3235722
3548753,UCJEPS,,,PreservedSpecimen,3e9e3e21-ee94-4b64-b214-ebce7f1fc254,JEPS51768,,Plantae,Tracheophyta,Magnoliopsida,Ranunculales,Papaveraceae,Eschscholzia californica,18097,Cham.,Eschscholzia,californica,,,Willis L. Jepson,,2/15/13,1913,2,15,46,,Feb 15 1913,,hilltop,,golden yellow,,,,,,Flowering/Fruiting,,,,,,,United States,California,Alameda,,San Leandro,,0,,,,,,,,,,,,,,,,,,,,,11/26/19 13:21,3e9e3e21-ee94-4b64-b214-ebce7f1fc254,46,urn:uuid:4a03ddd4-7eaf-4dd9-a0fd-0ca9d8983097,http://cch2.org/portal/collections/individual/index.php?occid=3548753
183208,OBI,,,PreservedSpecimen,9cb95273-82ad-47ba-90c4-4016843ab438,OBI103931,80367,Plantae,Tracheophyta,Magnoliopsida,Ranunculales,Papaveraceae,Eschscholzia californica,18097,Cham.,Eschscholzia,californica,,,Kristen M. Nelson,,2/16/13,2013,2,16,47,,2/16/13,,"Full sun. Locally common, with annuals, many weedy.",,"Plants up to 12 inches tall, milky latex when crushed; petals bright orange.",,,,,,,,,,,,,United States,California,San Luis Obispo,,Ca. 0.6 mile northeast of Avila Beach Ca. 0.35 driving mile west of San Luis Bay Drive on Avila Beach Drive. Adjacent to distrubed roadside pull-out and immediately south of San Luis Obispo Creek.,,0,,,,,,,,,,,,6,,,,,,,,Jordan Collins,3/3/15 0:00,,12,urn:uuid:2194725c-7c86-44a6-a4b6-5fa19d7588ea,http://cch2.org/portal/collections/individual/index.php?occid=183208
519179,SD,,,PreservedSpecimen,{00B3B709-9892-44C0-AF2E-7666B12719F0},SD00032086,SD167538,Plantae,Tracheophyta,Magnoliopsida,Ranunculales,Papaveraceae,Eschscholzia californica,18097,Cham.,Eschscholzia,californica,,,Andrea Harrison,Michelle McNearney,2/17/05,2005,2,17,48,,17-Feb-05,,,,"Single tap root, multiple reddish stems and soft red tinged leaves, bright golden cup-like flower.",,,,,Cedar fire burn area,FL,,,,,,,United States,California,San Diego,,"Goodan Ranch open space preserve, approx 500 yards south of entrance, near fire road",,0,,32.9374,-116.9842,WGS84,,,n/a,,Coordinates from label,,,291,,,,,,,,,1/15/20 10:58,SD167538,43,urn:uuid:f79881d8-8324-46ed-b0eb-cc0ea7fecfa2,http://cch2.org/portal/collections/individual/index.php?occid=519179
317824,UCSB,,UCSB,PreservedSpecimen,31132db6-decb-4c48-9e71-ee6b591adf87,UCSB009005,34644,Plantae,Tracheophyta,Magnoliopsida,Ranunculales,Papaveraceae,Eschscholzia californica,18097,Cham.,Eschscholzia,californica,,,"Mamone, S.",,2/18/78,1978,2,18,49,,,,Common with Brassicaceae and Cotoneaster pannusa in open field inbetween medium shrubs in sandy soil,,,,,,,,,,,,,,Sheet - 1,United States,California,Santa Barbara,,.25 miles oceanward of intersection of Los Carneros and El Colegio Roads in field across from Devereux Child Care Center,,0,,34.412326,-119.877539,WGS84,1000,,gwahlert (2020-01-21 11:24:27),,georef batch tool 2020-01-21,reviewed - high confidence,,,,,,,,,,,7/3/14 12:34,,35,urn:uuid:c6f994cc-0310-4f00-a951-e5deb730ecfd,http://cch2.org/portal/collections/individual/index.php?occid=317824
375325,SDSU,,,PreservedSpecimen,f47b1e93-f95f-4ba4-ad22-387524607012,847,SDSU00847,Plantae,Tracheophyta,Magnoliopsida,Ranunculales,Papaveraceae,Eschscholzia californica subsp. californica,42299,Cham.A,Eschscholzia,californica,subsp.,californica,"Snyder, G.",,2/18/62,1962,2,18,49,,2/18/62,,Eastern Slope.,,,,,,,,,,0,,,,,Mexico,Baja California,,,"South Island in the Los Coronados Islands, Mexico.",,0,,32.40571,-117.24369,WGS84,1800,,,,GeoLocate,,,,,,,,,,,SDSU,10/10/19 20:14,,6,urn:uuid:f47b1e93-f95f-4ba4-ad22-387524607012,http://cch2.org/portal/collections/individual/index.php?occid=375325
615457,SFV,,,PreservedSpecimen,33c19e01-26ae-4f7f-8584-86000a224470,SFV109916,SFV-1365,Plantae,Tracheophyta,Magnoliopsida,Ranunculales,Papaveraceae,Eschscholzia californica,18097,Cham.,Eschscholzia,californica,,,K. A. Wilson,,2/18/61,1961,2,18,49,,18-Feb-61,,,,Persisting in garden. Root with orange sap. Flower color: petals orange-yellow.,,,,,,Flowering,Persisting from cultivation,,,,,,United States,California,Los Angeles,,"Santa Monica Mountains; Mulholland Highway, 2 miles west of Seminole Hot Springs on abandoned, overgrown house lot.",,0,,34.1,-118.8,,1000,34° 6m N; 118° 48m W,,,,,,500,,,,,1640 ft.,,,JNH,9/11/13 0:00,,41,urn:uuid:33c19e01-26ae-4f7f-8584-86000a224470,http://cch2.org/portal/collections/individual/index.php?occid=615457
938887,RSA,RSA,,PreservedSpecimen,6b830923-4361-4d9b-a6cd-f1cb61d2f4bc,,32924,Plantae,Tracheophyta,Magnoliopsida,Ranunculales,Papaveraceae,Eschscholzia californica,18097,Cham.,Eschscholzia,californica,,,M. B. Dunkle,,2/18/33,1933,2,18,49,,2/18/33,,,,,,,,,,,,,flowers,,,Herbarium sheet - 1,United States,California,San Diego County,,"North hillside by beach, Del Mar.",,0,,,,,,,,,,,,9,,,,,,,,,9/21/18 11:35,18576419,17,urn:uuid:ef2035b1-2dc7-4a22-bc56-289b2f8fbb6c,http://cch2.org/portal/collections/individual/index.php?occid=938887
1349031,DAV,,,PreservedSpecimen,UCD95347,DAV307411,DAV31126; UCD95347,Plantae,Tracheophyta,Magnoliopsida,Ranunculales,Papaveraceae,Eschscholzia californica,18097,Cham.,Eschscholzia,californica,,,Kenneth A. Wilson,,2/18/61,1961,2,18,49,,18-Feb-61,"On abandoned, overgrown house lot. Persisting in garden. Petals orange-yellow. Root with orange sap.",,,,,,,,,,,,,,,,United States,California,Los Angeles County,,Los Angeles County: Santa Monica Mtns. Mulholland Hwy. 2 miles west of Seminole Hot Springs.,,0,,34.099405,-118.80377,WGS84,1000,,Rancho Santa Ana (no. 9),,Google Earth (copied from SBBG17294),,Date Georeferenced: Wed Mar 26 13:44:51 2014,,,,,,,,,amilkey,10/21/19 15:55,UCD95347,39,urn:uuid:9a1593db-ca43-40dc-8b4a-d6201969ed4c,http://cch2.org/portal/collections/individual/index.php?occid=1349031
1976317,SD,,,PreservedSpecimen,{F8EBD3B6-187E-46EC-BD19-592928DD46B7},,SD92798,Plantae,Tracheophyta,Magnoliopsida,Ranunculales,Papaveraceae,Eschscholzia californica subsp. mexicana,207634,(Greene) C. Clark,Eschscholzia,californica,subsp.,mexicana,Reid Moran,James L. Reveal,2/18/73,1973,2,18,49,,18-Feb-73,,Local in gravelly volcanic soil.,,,,,,,,FL,,,,,,,Mexico,Baja California Sur,Unknown,,Northeast base of Volcan las Tres Vírgenes.,,0,,27.48333,-112.6,WGS84,,,n/a,,Coordinates from label,,,1020,,,,,,,,,1/15/20 10:58,SD92798,43,urn:uuid:451523c5-85af-4bf7-8fd5-e6c41773f7ec,http://cch2.org/portal/collections/individual/index.php?occid=1976317
3183703,UCJEPS,,,PreservedSpecimen,f621d8bc-aab1-44d5-90e7-fc13969f0b01,UC1126405,,Plantae,Tracheophyta,Magnoliopsida,Ranunculales,Papaveraceae,Eschscholzia californica,18097,Cham.,Eschscholzia,californica,,,F. W. Embree,,2/18/35,1935,2,18,49,,Feb 18 1935,,"chap., e slope",,,,,,,,Flowering/Fruiting,,,,,,,United States,California,Santa Barbara,,"Arroyo Burro Canyon Santa Barbara National Forest, Santa Barbara Quadrangle (near head)",,0,,34.4897,-119.7488,NAD27,805,TRS: 5N27W30,,,trs2LL,,,685,,,,,2250 ft,,,,5/30/12 22:03,f621d8bc-aab1-44d5-90e7-fc13969f0b01,46,urn:uuid:44424d9d-80c4-48d6-9f10-1ddbcca39c97,http://cch2.org/portal/collections/individual/index.php?occid=3183703
83834,SBBG,,,PreservedSpecimen,66b5750b-bf7b-4219-8d49-bcc7575d6b75,SBBG168567,41684,Plantae,Tracheophyta,Magnoliopsida,Ranunculales,Papaveraceae,Eschscholzia californica,18097,Cham.,Eschscholzia,californica,,,R. N. Philbrick w/ J. R. Haller,,2/19/65,1965,2,19,50,,2/19/65,,cyn,,,,,,,,Flowers Present,,,,,,,United States,California,Santa Barbara,,Santa Rosa Island: just SE of mouth of Lobos Cyn,,0,,34.0178,-120.0958,NAD83,750,,dwilken,,MyTopo,,,,,,,,100 [ft],,,,9/25/18 1:01,,16,urn:uuid:519e2cf2-df9a-4f2e-9fec-5c3d2e18d26a,http://cch2.org/portal/collections/individual/index.php?occid=83834
647350,RSA,POM,,PreservedSpecimen,0498948e-26a7-4984-9e2f-d7677c77acbc,,305121,Plantae,Tracheophyta,Magnoliopsida,Ranunculales,Papaveraceae,Eschscholzia californica,18097,Cham.,Eschscholzia,californica,,,"Henry J. Ramsey, Henry J. Ramsey",,2/19/37,1937,2,19,50,,2/19/37,,,,,,,,,,,,,flowers,,,Herbarium sheet - 1,United States,California,Kern County,,Jasmin.,,0,,,,,,,,,,,,,,,,,,,,,9/21/18 11:30,18508926,17,urn:uuid:f183252e-65df-4ab6-a0c9-2bd466985924,http://cch2.org/portal/collections/individual/index.php?occid=647350
791762,RSA,RSA,,PreservedSpecimen,491fc742-4bd4-420c-bc9c-34678b33e711,,627414,Plantae,Tracheophyta,Magnoliopsida,Ranunculales,Papaveraceae,Eschscholzia californica,18097,Cham.,Eschscholzia,californica,,,"R. N. Philbrick, J. R. Haller",,2/19/65,1965,2,19,50,,2/19/65,,,,,,,,,,,,,flowers,,,Herbarium sheet - 1,United States,California,Santa Barbara County,,Santa Rosa Island. Just SE of mouth of Lobos Canyon.,,0,,,,,,,,,,,,30,,,,,,,,,9/21/18 11:35,18717039,17,urn:uuid:8d60a82c-e097-46e8-b881-f454a1cc371f,http://cch2.org/portal/collections/individual/index.php?occid=791762
1301693,DAV,,,PreservedSpecimen,f93a271c-1d2a-4b12-8676-b2ac31172f3f,DAV307463,DAV158068; UCD19449,Plantae,Tracheophyta,Magnoliopsida,Ranunculales,Papaveraceae,Eschscholzia californica,18097,Cham.,Eschscholzia,californica,,,J. Shepard,,2/19/00,2000,2,19,50,,19-Feb-00,,,,,,,,,,,,,,,,,United States,California,Yolo County,,"Grasslands Regional Park. East of Davis, from intersection of I-80 and Mace Blvd., 3.5 mi. south on Mace Blvd. (County Road 104), thence east 1/4 mi. along unpaved entrance road.",,0,,38.492222,-121.686667,,,38° 29m 32s N; 121° 41m 12s W,,,,,,12,,,,,40ft,,,,10/21/19 18:01,UCD19449,39,urn:uuid:f93a271c-1d2a-4b12-8676-b2ac31172f3f,http://cch2.org/portal/collections/individual/index.php?occid=1301693
3043720,CATA,,,PreservedSpecimen,,3010,,Plantae,Tracheophyta,Magnoliopsida,Ranunculales,Papaveraceae,Eschscholzia californica,18097,Cham.,Eschscholzia,californica,,,Amy Catalano,Schylar Gholson,2/19/16,2016,2,19,50,,19-Feb-16,"PLANTS OF THE CALIFORNIA ISLANDS, Flora of Santa Catalina Island, Scattered",Island chaparral,,"Annual, flower dark orange, reflexed collar on receptacle rim, stem with red vertical stripes; leaves light green with red tips, pinnately dissected",,,,,"Amsinckia intermedia, Quercus pacifica, Rhus integrifolia, Rhamnus pirifolia",,,,,,,,U.S.A.,California,Los Angeles,,"Santa Catalina Island: Along Cape Canyon Road, east of drainage with old Middle Cape Reservoir",,0,,33.367136,-118.408605,NAD83,,11S 368956.39E 3692874.96N,,,,,,268,,,,,,,,,7/15/19 18:14,3010,52,urn:uuid:4e430062-ee7d-4414-b8b7-857da55ed620,http://cch2.org/portal/collections/individual/index.php?occid=3043720
3363935,UCJEPS,,,PreservedSpecimen,95e5f0d2-4779-41fd-b0f0-8fe4554722eb,JEPS93407,,Plantae,Tracheophyta,Magnoliopsida,Ranunculales,Papaveraceae,Eschscholzia californica,18097,Cham.,Eschscholzia,californica,,,"Ralph N. Philbrick, J. R. Haller",,2/19/65,1965,2,19,50,,Feb 19 1965,,,,,,,,,,Flowering/Fruiting,,,,,,,United States,California,Santa Barbara,,just s.e. of mouth Lobos Canyon (Santa Rosa Isl.); Santa Rosa Isl.,,0,,,,,,,,,,,,30,,,,,100 ft,,,,5/29/12 16:48,95e5f0d2-4779-41fd-b0f0-8fe4554722eb,46,urn:uuid:db077cef-aba5-4095-9f08-f76617868c91,http://cch2.org/portal/collections/individual/index.php?occid=3363935
183170,OBI,,,PreservedSpecimen,eb7f6090-bd1e-4822-b076-e1e41aa47305,OBI103960,11794,Plantae,Tracheophyta,Magnoliopsida,Ranunculales,Papaveraceae,Eschscholzia californica,18097,Cham.,Eschscholzia,californica,,,Mona Stockdale,,2/20/60,1960,2,20,51,,20-Feb-60,,,,,,,,,,,,,,,,,United States,California,Monterey,,Soledad,,0,,,,,,,,,,,,,,,,,,,,kdpearso,7/19/13 0:00,,12,urn:uuid:27994f5b-4bae-40a5-8a53-3d62ced84d14,http://cch2.org/portal/collections/individual/index.php?occid=183170
518992,SD,,,PreservedSpecimen,{21F0FC55-6853-4C46-B383-8CCF90FF1CC5},SD00032861,SD28329,Plantae,Tracheophyta,Magnoliopsida,Ranunculales,Papaveraceae,Eschscholzia californica subsp. peninsularis,,,,,,,Frank F. Gander,,2/21/41,1941,2,21,52,,21-Feb-41,,,,,,,,,,FL,,,,,,,United States,California,San Diego,,Cottonwood,,0,,32.60965,-116.69782,WGS84,402,,mak,,"TOPO! v3.4.2, Wray, C., The Historic Backcountry, 2004",,,,,,,,unknownft.,,,,1/15/20 10:56,SD28329,43,urn:uuid:001281c7-7b10-4776-821a-5d9ec953f44a,http://cch2.org/portal/collections/individual/index.php?occid=518992
1631753,UCR,,,PreservedSpecimen,UCR-BPS-212170,,UCR-212170,Plantae,Tracheophyta,Magnoliopsida,Ranunculales,Papaveraceae,Eschscholzia californica subsp. mexicana,207634,(Greene) C. Clark,Eschscholzia,californica,subsp.,mexicana,Wendy Hodgson,Dawn Goldman,2/21/01,2001,2,21,52,,2/21/01,Common annual; fls. orange-yellow.,"Rocky/volcanic tuff with Calliandra eriophylla, Thysanocarpus, Ferocactus cylindraceus eastwoodiae, Cercidium microphyllum, Cylindropuntia acanthocarpa, Dichelostemma pulchella, Encelia farinosa, Echinocereus engelmannii, Opuntia engelmannii, Carnegiea gigantea, Prosopis velutina, Aristida, Eriogonum wrightii, Dodonaea, Ericameria laricifolia, Sphaeralcea ambigua, Simmondsia chinensis, Cryptantha, Lycium, Amsinckia, Celtis pallida, Porophyllum gracile, Ephedra.",,,,,,,,,,,,,,,United States,Arizona,Maricopa,,"Tonto National Forest, Goldfield Mountains, Willow Creek, off AZ Hwy 88",,0,,33.53383,-111.45943,,,,,,Collector GPS,,,620,,,,,,,,,1/19/20 17:50,UCR-BPS-212170,3,urn:uuid:a5c84f58-af73-47dd-aa35-5295259691e8,http://cch2.org/portal/collections/individual/index.php?occid=1631753
3220879,UCJEPS,,,PreservedSpecimen,c91f2ca7-9ef8-4ac1-b691-6fe449afac53,UC1137330,,Plantae,Tracheophyta,Magnoliopsida,Ranunculales,Papaveraceae,Eschscholzia californica,18097,Cham.,Eschscholzia,californica,,,"L. R. Short, I. H. Johnson",,2/21/34,1934,2,21,52,,Feb 21 1934,No TRS section given,"Type: grassland, density 3.5, slope 5% s, gravelly clay loam soil, sunny slopes",,,,,,,,Flowering/Fruiting,,,,,,,United States,California,Merced,,San Luis Gonzaga grant Pacheco Pass Quad.,,0,,37.0619,-121.1917,NAD27,4828,TRS: 10S7E,,,trs2LL,,,274,,,,,900 ft,,,,5/30/12 22:15,c91f2ca7-9ef8-4ac1-b691-6fe449afac53,46,urn:uuid:907394df-8b1d-4695-a997-c985c76f875a,http://cch2.org/portal/collections/individual/index.php?occid=3220879
50043,SBBG,,,PreservedSpecimen,230d366a-ac6d-4d56-b7bf-592dc56c90a5,SBBG169406,22558,Plantae,Tracheophyta,Magnoliopsida,Ranunculales,Papaveraceae,Eschscholzia californica,18097,Cham.,Eschscholzia,californica,,,H. M. Pollard,,2/22/65,1965,2,22,53,,2/22/65,,"sandy soil, lower slope of ridge",,,,,,,,Flowers Present,,,,,,,United States,California,Santa Barbara,,"N of Honda Valley, La Mesa, Santa Barbara",,0,,34.407,-119.709,NAD83,1000,,dwilken,,MyTopo,,,,,,,,,,,,9/25/18 1:01,,16,urn:uuid:f9fa60b8-a656-46c5-9fcd-05f6fd899328,http://cch2.org/portal/collections/individual/index.php?occid=50043
375285,SDSU,,,PreservedSpecimen,c058d740-d5f3-4f6d-8b3b-7fc1b0b4b025,807,SDSU00807,Plantae,Tracheophyta,Magnoliopsida,Ranunculales,Papaveraceae,Eschscholzia californica subsp. californica,42299,Cham.,Eschscholzia,californica,subsp.,californica,"Beauchamp, R. M.",,2/22/67,1967,2,22,53,,2/22/67,,On dry area on south slope. Only speci men seen.,,,,,,,,,,0,,,,,United States,California,San Diego,,Jamul Mountain.,,0,,32.66359,-116.89665,WGS84,1609,,San Diego NHM B,,TOPO! (copied from SDSU10255),,georef from 2006-2015 archive backup file; Date Georeferenced: Wed Feb 29 13:21:38 2012,,,,,,,,,preprocessed,10/8/19 14:25,,6,urn:uuid:c058d740-d5f3-4f6d-8b3b-7fc1b0b4b025,http://cch2.org/portal/collections/individual/index.php?occid=375285
518946,SD,,,PreservedSpecimen,{3C066BA1-020F-4C35-8342-EA41129C4819},SD00032927,SD10369,Plantae,Tracheophyta,Magnoliopsida,Ranunculales,Papaveraceae,Eschscholzia californica subsp. peninsularis,,,,,,,Frank F. Gander,,2/22/35,1935,2,22,53,,22-Feb-35,,,,,,,,,,FL,,,,,,,United States,California,San Diego,,Rolando,,0,,32.76317,-117.04911,WGS84,805,,mak,,TOPO! v3.4.2,,,,,,,,unknownft.,,,,1/15/20 10:56,SD10369,43,urn:uuid:a2cb687f-dcf3-48e8-94a4-581a8a4fbbcb,http://cch2.org/portal/collections/individual/index.php?occid=518946
519008,SD,,,PreservedSpecimen,{80C02D66-7BB0-484A-B47A-E62329B53DF5},SD00031828,SD38054,Plantae,Tracheophyta,Magnoliopsida,Ranunculales,Papaveraceae,Eschscholzia californica,18097,Cham.,Eschscholzia,californica,,,Edith A. Purer,,2/22/35,1935,2,22,53,,22-Feb-35,,,,,,,,,,FL,,,,,,,United States,California,San Diego,,"View Point Ranch, north of Lake Hodges",,0,,33.0829,-117.0854,WGS84,,,n/a,,Coordinates from label,,,,,,,,unknownft.,,,,1/15/20 10:58,SD38054,43,urn:uuid:8ac54449-12f3-4d99-ab4b-87315a4490ed,http://cch2.org/portal/collections/individual/index.php?occid=519008
626915,IRVC,,,PreservedSpecimen,825eb1d6-ebfa-449e-8919-a41ea0d3ca50,IRVC106070,IRVC2787,Plantae,Tracheophyta,Magnoliopsida,Ranunculales,Papaveraceae,Eschscholzia californica,18097,Cham.,Eschscholzia,californica,,,s.n.,,2/22/65,1965,2,22,53,,22-Feb-65,,,,,,,,,,,,,,,,,United States,California,Kern,,Willow Springs,,0,,,,,,,,,,,,,,,,,,,,,11/10/19 3:24,,37,urn:uuid:825eb1d6-ebfa-449e-8919-a41ea0d3ca50,http://cch2.org/portal/collections/individual/index.php?occid=626915
714322,RSA,RSA,,PreservedSpecimen,245d95db-44d9-4f30-ade8-3a5fd8006c04,RSA0081445,840591,Plantae,Tracheophyta,Magnoliopsida,Ranunculales,Papaveraceae,Eschscholzia californica,18097,Cham.,Eschscholzia,californica,,,"Erika M. Gardner, Chul Paik",,2/22/15,2015,2,22,53,,2/22/15,,In wash.,,,,,,,"Ephedra, Cholla, Erigonum fasisiculatum, Yucca brevifolia",,,,flowers,,,Herbarium sheet - 1,United States,California,Kern County,,"Cane Canyon. Along east-west ridge, north side of canyon.",,0,,35.59372,-118.21849,,,,,,,,,1051,,,,,,,,,9/21/18 11:35,18691890,17,urn:uuid:57be9855-1ab4-4d35-b33a-5d19065f72f8,http://cch2.org/portal/collections/individual/index.php?occid=714322
908981,RSA,RSA,,PreservedSpecimen,5d305c4e-b5d8-498c-a965-0db41f12f516,,720072,Plantae,Tracheophyta,Magnoliopsida,Ranunculales,Papaveraceae,Eschscholzia californica,18097,Cham.,Eschscholzia,californica,,,"Naomi Fraga, Amber Maurice",,2/22/03,2003,2,22,53,,2/22/03,,"Very steep south facing slope. Loose granitic soil with many annials blooming. Associated species: Salvia columbarie, Cryptantha sp., Eschscholzia californica, Coreopsis bigelovii, Erodium cicutarium, Phacelia fremontii, and Amsinkia tesselatta.",,,,,,,,,,,flowers,,,Herbarium sheet - 1,United States,California,Kern County,,"THE OWENS PEAK EASTERN WATERSHED. Short Canyon, near trail head above road.",,0,,35.7119,-117.9136,NAD27,,,,,,,,1189,,,,,,,,,9/21/18 11:35,18768244,17,urn:uuid:0d50fde9-a2ba-440d-8774-722787cff4b7,http://cch2.org/portal/collections/individual/index.php?occid=908981
915005,RSA,RSA,,PreservedSpecimen,600e3ef0-d4da-4aa7-adfd-3a7674d72f7f,,445606,Plantae,Tracheophyta,Magnoliopsida,Ranunculales,Papaveraceae,Eschscholzia californica,18097,Cham.,Eschscholzia,californica,,,H. M. Pollard,,2/22/65,1965,2,22,53,,2/22/65,,Sandy loam on open slope.,,,,,,,,,,,flowers & fruits,,,Herbarium sheet - 1,United States,California,Santa Barbara County,,"Ridge N of Honda Valley, la Mesa.",,0,,,,,,,,,,,,,,,,,,,,,9/21/18 11:35,18342514,17,urn:uuid:cdbac68d-e743-469b-908d-bc0b65f37c50,http://cch2.org/portal/collections/individual/index.php?occid=915005
1615338,UCR,,,PreservedSpecimen,UCR-BPS-196710,UCR0063888,UCR-196710,Plantae,Tracheophyta,Magnoliopsida,Ranunculales,Papaveraceae,Eschscholzia californica,18097,Cham.,Eschscholzia,californica,,,Naomi Fraga,Amber Maurice,2/22/03,2003,2,22,53,,2/22/03,Bright orange fls. The population on this hillside was so abundant it was visible from intersection of Hwy 395 and 14.,"Very steep S-facing slope, loose granitic soil with many annuals blooming. Assoc. with Salvia columbarie, Cryptantha, Echscholzia californica, Coreopsis bigelovii, Phacelia fremontii, Amsinckia tessellata, etc.",,,,,,,,,,,,,,,United States,California,Kern,,"Owens Peak Eastern Watershed, Short Canyon, near trail head above road",,0,,35.71194,-117.91361,,,,,,Collector GPS,,,1189,,,,,,,,,1/19/20 17:50,UCR-BPS-196710,3,urn:uuid:5778adec-b262-452b-965d-109e270d2842,http://cch2.org/portal/collections/individual/index.php?occid=1615338
2151386,CHSC,VascularPlants,,PreservedSpecimen,062932ef-14d5-4d29-8e65-5789463e0eb3,CHSC098034,,Plantae,Tracheophyta,Magnoliopsida,Ranunculales,Papaveraceae,Eschscholzia californica,18097,Cham.,Eschscholzia,californica,,,Naomi Fraga,Amber Maurice,2/22/03,2003,2,22,53,,2/22/03,Label says: Herbarium of Rancho Santa Ana Botanic Garden. Entered into RSA Database (10210RSA).,"Very steep south facing slope. Loose granitic soil with many annuals blooming. Associated species: Salvia columbarie, Cryptantha sp., Eschscholzia californica, Coreopsis bigelovii, Erodium cicutarium, Phacelia fremontii, and Amsinkia tesselatta. Bright orange flowers. The population on this hillside was so abundant, it was visible from intersection of Hwy 395 and 14.",,,,,,,,,,,,,,,United States,California,Kern,,"Sierra Nevada; Southern Sierra Nevada region: The Owens Peak Eastern Watershed. Short Canyon, near trail head above road. USGS Quadrangle: Owens Peak 1:24,000",,0,,35.711944,-117.913611,,,35§ 42m 43s N; 117§ 54m 49s W,,,,,,1189,,,,,,,,,1/31/19 14:26,,44,urn:uuid:062932ef-14d5-4d29-8e65-5789463e0eb3,http://cch2.org/portal/collections/individual/index.php?occid=2151386
2207250,UCSC,,,PreservedSpecimen,c84396c4-9fdd-408f-9061-53b1b4d76c69,,,Plantae,Tracheophyta,Magnoliopsida,Ranunculales,Papaveraceae,Eschscholzia californica,18097,Cham.,Eschscholzia,californica,,,Erin Mulligan,,2/22/19,2019,2,22,53,,22-Feb-19,,Meadow between the village and the bus stop. Next to lightpost along edge of sidewalk on road going to the Village.,,"Some open, some not. ~40 cm tall. Petals yellow-orange. Surrounded by dense grasses.",,,,,,Flowering,,,,,,,United States,California,Santa Cruz,Santa Cruz,,,0,,36.9856333,-122.05418,WGS84,5,,,,iNaturalist,,,144,,,,,,,,,2/28/19 15:32,,13,urn:uuid:c84396c4-9fdd-408f-9061-53b1b4d76c69,http://cch2.org/portal/collections/individual/index.php?occid=2207250
3212336,UCJEPS,,,PreservedSpecimen,b845badf-36f2-4e0d-9bab-e77ad4d8006b,UC576514,,Plantae,Tracheophyta,Magnoliopsida,Ranunculales,Papaveraceae,Eschscholzia californica,18097,Cham.,Eschscholzia,californica,,,Edith A. Purer,,2/22/35,1935,2,22,53,,Feb 22 1935,,,,,,,,,,Flowering/Fruiting,,,,,,,United States,California,San Diego,,n Lake Hodges; View POint Ranch,,0,,33.0829,-117.0854,WGS84,804,,San Diego NHM E,,Google Earth,,georef from 2015-2018 archive backup file; Wed May 3 15:14:20 2017; (copied from SEINET3820356),,,,,,,,,,5/31/12 19:05,b845badf-36f2-4e0d-9bab-e77ad4d8006b,46,urn:uuid:195f54c9-3c7b-4435-b8a6-1ae6e4930d4f,http://cch2.org/portal/collections/individual/index.php?occid=3212336
3442598,UCJEPS,,,PreservedSpecimen,37482616-75b5-4ffd-b867-7dea3bab4cee,UC1927585,,Plantae,Tracheophyta,Magnoliopsida,Ranunculales,Papaveraceae,Eschscholzia californica,18097,Cham.,Eschscholzia,californica,,,"Naomi Fraga, Amber Maurice",,2/22/03,2003,2,22,53,,02 22 2003,"Bright orange flowers. The population on this hillside was so abundant, it was visible from intersection of Hwy 395 and 14.","Very steep south facing slope. Loose granitic soil with many annials blooming.; Associated species: Salvia columbarie, Cryptantha sp., Eschscholzia californica, Coreopsis bigelovii, Erodium cicutarium, Phacelia fremontii, and Amsinkia tesselatta.",,,,,,,,,,,,,,,United States,California,Kern,,"Sierra Nevada; Southern Sierra Nevada region; THE OWENS PEAK EASTERN WATERSHED. Short Canyon, near trail head above road.",,0,,35.7119,-117.9136,,,,,,,,,1189,,,,,1189 m,,,,5/31/12 16:52,37482616-75b5-4ffd-b867-7dea3bab4cee,46,urn:uuid:d21a35a2-e5c0-4037-a493-b5f7a9f66814,http://cch2.org/portal/collections/individual/index.php?occid=3442598
183173,OBI,,,PreservedSpecimen,2c5e13ab-e677-4000-ab47-02e3d8218c8d,OBI103911,11801,Plantae,Tracheophyta,Magnoliopsida,Ranunculales,Papaveraceae,Eschscholzia californica,18097,Cham.,Eschscholzia,californica,,,Mrs. Robert F. Hoover,,2/23/62,1962,2,23,54,,23-Feb-62,,,,,,,,,,,,,,,,,United States,California,San Luis Obispo,,Cambria district,,0,,35.564,-121.08084,WGS84,3317,,CalPoly H,,GoogleMaps via BerkeleyMapper (copied from OBI13052),,georef from old CCH cumulative file,,,,,,,,,preprocessed,7/19/13 0:00,,12,urn:uuid:341ebfd9-3766-492c-a0e2-baa28bee12fd,http://cch2.org/portal/collections/individual/index.php?occid=183173
235885,UCSC,,,PreservedSpecimen,92ed5705-5a69-4dda-b352-f183c60cca05,,7434,Plantae,Tracheophyta,Magnoliopsida,Ranunculales,Papaveraceae,Eschscholzia californica,18097,Cham.,Eschscholzia,californica,,,O. Johnson,,2/23/11,2011,2,23,54,,23-Feb-11,,"Sections of one large & one small plant. Very few plts blooming in field, but many plts with lvs.",,,,,,,,,,,,,,,United States,California,Santa Cruz,,"Santa Cruz, Mima Meadow, UCSC",,0,,36.98336,-122.06746,preprocessed,,,676,,UCSanta Cruz C,,GoogleMaps via BerkeleyMapper (copied from UCSC7041),,,,,,,UCSC,,Oscar Johnson,5/20/16 19:58,,13,urn:uuid:284a96d6-ec25-45ef-b974-78eda599e712,http://cch2.org/portal/collections/individual/index.php?occid=235885
236369,UCSC,,,PreservedSpecimen,d1b64921-cd8e-4557-8d17-13a3de9c806d,,8123,Plantae,Tracheophyta,Magnoliopsida,Ranunculales,Papaveraceae,Eschscholzia californica,18097,Cham.,Eschscholzia,californica,,,O. Johnson,,2/23/11,2011,2,23,54,,23-Feb-11,,"Sections of one large & one small plant. Very few plants blooming in field, but many plants with leaves.",,,,,,,,,,,,,,,United States,California,Santa Cruz,,"Santa Cruz, Mima Meadow, UCSC",,0,,,,,,,,,,,,,,,,,,Lise Peterson,,41578,5/20/16 19:58,,13,urn:uuid:d72fdf02-29b7-40ca-8c03-6c09d96b7423,http://cch2.org/portal/collections/individual/index.php?occid=236369
240124,UCSC,,,PreservedSpecimen,042aaf47-36ed-478f-ac49-34b5ae818113,,,Plantae,Tracheophyta,Magnoliopsida,Ranunculales,Papaveraceae,Eschscholzia californica,18097,Cham.,Eschscholzia,californica,,,Megan M. Hughes,,2/23/18,2018,2,23,54,,23-Feb-18,,Grassland,,"erect herb, collected in grassy meadow with full sun; leaves blue-green in color (some with red apex) and heavily dissected, glaucous, mostly basal; leaf petioles erect; solitary flower on long stem, 4 free orange (yellow) petals; spreading collar/receptacle rim 2-5 mm, red along rim edge; sepals conic, surrounding buds, and deciduous when flowers open; petals deciduous after pollination; stamens many, 2 carpels; fruit a long oblong capsule.",,,,,"grasses, wild radish",,,,,,,,United States,California,Santa Cruz,Santa Cruz,"100m south of West Remote Parking lot, 10m off trail, Oakes Meadow, UCSC Campus",,0,,36.9881,-122.0658,WGS84,,,,,iNaturalist,,,175,,,,,,,,,3/1/18 14:23,,13,urn:uuid:b318e2aa-8405-4c76-9566-72d571d696a6,http://cch2.org/portal/collections/individual/index.php?occid=240124
240324,UCSC,,,PreservedSpecimen,116d7f02-98ed-4d98-92f3-2a247d82e75e,,,Plantae,Tracheophyta,Magnoliopsida,Ranunculales,Papaveraceae,Eschscholzia californica,18097,Cham.,Eschscholzia,californica,,,Megan M. Hughes,,2/23/18,2018,2,23,54,,23-Feb-18,,Grassland,,"erect herb, collected in grassy meadow with full sun; leaves blue-green in color (some with red apex) and heavily dissected, glaucous, mostly basal; leaf petioles erect; solitary flower on long stem, 4 free orange (yellow) petals; spreading collar/receptacle rim 2-5 mm, red along rim edge; sepals conic, surrounding buds, and deciduous when flowers open; petals deciduous after pollination; stamens many, 2 carpels; fruit a long oblong capsule.",,,,,"grasses, wild radish",,,,,,,,United States,California,Santa Cruz,Santa Cruz,"100m south of West Remote Parking lot, 10m off trail, Oakes Meadow, UCSC Campus",,0,,36.9881,-122.0658,WGS84,,,,,iNaturalist,,,175,,,,,,,,,3/1/18 20:39,,13,urn:uuid:a60e8e6a-3993-430a-a357-caa54be07ef0,http://cch2.org/portal/collections/individual/index.php?occid=240324
317840,UCSB,,UCSB,PreservedSpecimen,0e967fb6-b1c6-4f4a-92aa-dfa8e9e406ae,UCSB009023,2164,Plantae,Tracheophyta,Magnoliopsida,Ranunculales,Papaveraceae,Eschscholzia californica,18097,Cham.,Eschscholzia,californica,,,"Atsatt, Pete",,2/23/58,1958,2,23,54,,,,,,,,,,,,,,,,,,Sheet - 1,United States,California,Santa Barbara,,"Santa Ynez Mountains, approx. 12 miles from peak of San Marcos Pass Road N. side of road across from Entrance Rd. to Cachuma Observation Point",,0,,,,,,,,,,,,,,,,,,,,,7/3/14 12:35,,35,urn:uuid:174df073-c506-43de-ab12-a4f3026041eb,http://cch2.org/portal/collections/individual/index.php?occid=317840
519349,SD,,,PreservedSpecimen,{54B0FCA9-31CC-45AA-84EE-F77F5D7C73DC},SD00032105,SD206129,Plantae,Tracheophyta,Magnoliopsida,Ranunculales,Papaveraceae,Eschscholzia californica,18097,Cham.,Eschscholzia,californica,,,David Woelfel,Beatrice Woelfel,2/23/08,2008,2,23,54,,23-Feb-08,,Granitic rock outcroppings and stream bottom,,"short, yellow to orange flws, lvs. finely divided, pale blue",,,,,Coastal Sage,FL,,,,,,,United States,California,San Diego,,"Rock Mountain Reserve, east of Sandia Canyon in SE corner of B-7 and about 1/4 mile west of San Diego/Riverside County Line",,0,,33.434,-117.244,WGS84,,,n/a,,Coordinates from label,,,305,,,,,,,,,1/15/20 10:58,SD206129,43,urn:uuid:76fd4390-71fc-45dd-a53c-43e2c06f0e70,http://cch2.org/portal/collections/individual/index.php?occid=519349
720792,RSA,RSA,,PreservedSpecimen,2771662c-bf0d-4417-bd8a-fc75d08113a8,,523173,Plantae,Tracheophyta,Magnoliopsida,Ranunculales,Papaveraceae,Eschscholzia californica,18097,Cham.,Eschscholzia,californica,,,Tim S. Ross,,2/23/91,1991,2,23,54,,2/23/91,,Recently burned chaparral,,,,,,,,,,,flowers & fruits,,,Herbarium sheet - 1,United States,California,Los Angeles County,,"Whittier Hills (Puente Hills), upper Turnbull Canyon, 1/4 air mile W of Turnbull Canyon road x Skyline Drive in heavily disturbed drainage area.",,0,,,,,,,,,,,,252,,,,,,,,,9/21/18 11:30,18530091,17,urn:uuid:42a4f224-a8d3-46e2-82d7-6c86059ab5e1,http://cch2.org/portal/collections/individual/index.php?occid=720792
2207204,UCSC,,,PreservedSpecimen,e61f3410-0777-4a3e-82b0-f2f0d11bdc2d,,,Plantae,Tracheophyta,Magnoliopsida,Ranunculales,Papaveraceae,Eschscholzia californica,18097,Cham.,Eschscholzia,californica,,,Briana Vasquez,,2/23/19,2019,2,23,54,,23-Feb-19,,"Growing in dark soil in small meadow, among grasses and other wildflowers, receiving full sun. Slight incline. On side of road.",,"Annual herb. Flowers light orange to red-orange, 4 petals, multiple stamens, sepals not present at flowering, leaves glabrous and lobed.",,,,,,Flowering,,,,,,,United States,California,Santa Cruz,Santa Cruz,"Approx. 30 ft. below Coolidge Drive on south side of road, approx. 100 ft. east of intersection at Hagar Dr.",,0,,36.9825,-122.0497,WGS84,53,,,,iNaturalist,,,364,,,,,,,,,2/28/19 15:32,,13,urn:uuid:e61f3410-0777-4a3e-82b0-f2f0d11bdc2d,http://cch2.org/portal/collections/individual/index.php?occid=2207204
2207439,UCSC,,,PreservedSpecimen,c57d184b-78ff-4159-b3e0-09c2983e26c4,,,Plantae,Tracheophyta,Magnoliopsida,Ranunculales,Papaveraceae,Eschscholzia californica,18097,Cham.,Eschscholzia,californica,,,Thomas Whaley,,2/23/19,2019,2,23,54,,23-Feb-19,,Lower Campus meadows/grassland,,"12cm tall, glabrous",,,,,,Flowering,,,,,,,United States,California,Santa Cruz,Santa Cruz,"Roughly halfway between the north side of Hagar Drive and the south side of the footpath leading to the Village, about 20m above the pedestrian warning sign",,0,,36.9868908,-122.05462,,4,,,,iNaturalist,,,144,,,,,,,,,2/28/19 15:32,,13,urn:uuid:c57d184b-78ff-4159-b3e0-09c2983e26c4,http://cch2.org/portal/collections/individual/index.php?occid=2207439
389244,SDSU,,,PreservedSpecimen,7a3f12fe-eba9-4fe9-bbb0-0825db03de7b,14928,SDSU14928,Plantae,Tracheophyta,Magnoliopsida,Ranunculales,Papaveraceae,Eschscholzia californica subsp. californica,42299,Cham.,Eschscholzia,californica,subsp.,californica,"Reiser, Craig H.",Fred T. Sproul,2/24/89,1989,2,24,55,,2/24/89,,Ocassional in the sage scrub and sometimes concentrated on berms as a fire-follower.,,Annual.,,,,,,,,0,,,,,United States,California,San Diego,,"Camp Joseph Pendleton MCB. San Diego County, California. Base Section: Bravo III.",Bravo three,0,,33.39167,-117.55,,1609,33.00° 23.00m 30s N; 117.00° 33.00m W,Mary Alice Kessler,,,,8-Jan-09,198,,,,,650ft.,PEND,,preprocessed,10/8/19 14:25,,6,urn:uuid:7a3f12fe-eba9-4fe9-bbb0-0825db03de7b,http://cch2.org/portal/collections/individual/index.php?occid=389244
519513,SD,,,PreservedSpecimen,{7BEE9779-BFEF-42F3-B031-44EA1ABFD3C5},SD00031806,SD244462,Plantae,Tracheophyta,Magnoliopsida,Ranunculales,Papaveraceae,Eschscholzia californica,18097,Cham.,Eschscholzia,californica,,,Jon P. Rebman,W. Schmidtmann & G. Kenney,2/24/15,2015,2,24,55,,24-Feb-15,,,,"Annual, flowers orange-yellow; rare",,,,,"Oak Woodland with Quercus agrifolia, Malosma laurina, Toxicodendron diversilobum, Salvia apiana, Artemisia californica, Baccharis salicifolia, & Platanus racemosa",FFL,,,,,,,United States,California,San Diego,,Camp Pendleton: central portion of Base; India Training Area; north of Basilone Rd. & east of Roblar Rd.; along a trail in a canyon bottom,,0,,33.35381,-117.34936,WGS84,,,n/a,,Coordinates from label,,,130,,,,,,,,,1/15/20 10:58,SD244462,43,urn:uuid:f918ad80-6241-42a9-853b-9fdc0cd416e0,http://cch2.org/portal/collections/individual/index.php?occid=519513
519517,SD,,,PreservedSpecimen,{C23E9130-1673-4D1A-AF66-14304D4C5CEE},SD00032117,SD245087,Plantae,Tracheophyta,Magnoliopsida,Ranunculales,Papaveraceae,Eschscholzia californica,18097,Cham.,Eschscholzia,californica,,,Jon P. Rebman,W. Schmidtmann & G. Kenney,2/24/15,2015,2,24,55,,24-Feb-15,,,,"Annual, flowers yellow; common",,,,,"Coastal Sage Scrub/Oak Woodland with Quercus agrifolia, Artemisia californica, Malosma laurina, Diplacus puniceus, Toxicodendron diversilobum, & Antirrhinum nuttallianum",FFL,,,,,,,United States,California,San Diego,,Camp Pendleton: east-central portion of Base; India Training Area; north of Lake O'Neill; east of the Santa Margarita River; on a rocky slope just east of De Luz Road along the Fallbrook Weapons Station border,,0,,33.36227,-117.31402,WGS84,,,n/a,,Coordinates from label,,,105,,,,,,,,,1/15/20 10:58,SD245087,43,urn:uuid:564917d3-ca1d-4a67-bf98-1f81758841ee,http://cch2.org/portal/collections/individual/index.php?occid=519517
1091319,RSA,RSA,,PreservedSpecimen,b40f0dd7-a4e8-401e-8ea6-58707ed39d5f,,433693,Plantae,Tracheophyta,Magnoliopsida,Ranunculales,Papaveraceae,Eschscholzia californica,18097,Cham.,Eschscholzia,californica,,,Ora M. Clark,,2/24/29,1929,2,24,55,,2/24/29,,,,,,,,,,,,,flowers,,,Herbarium sheet - 1,United States,California,Riverside County,,"Cabazon, Colorado Desert.",,0,,33.9166667,-116.7666667,NAD83,,,,,,,1-4 sections (appx. 1600-6400 M); 1-4 sections (appx. 1600-6400 M),,,,,,,,,,9/21/18 11:35,18664771,17,urn:uuid:556b7c35-4af1-48ef-b178-b087e797137a,http://cch2.org/portal/collections/individual/index.php?occid=1091319
1580562,UCR,,,PreservedSpecimen,UCR-BPS-161685,UCR0064036,UCR-161685,Plantae,Tracheophyta,Magnoliopsida,Ranunculales,Papaveraceae,Eschscholzia californica,18097,Cham.,Eschscholzia,californica,,,George K. Helmkamp,E.A. Helmkamp,2/24/05,2005,2,24,55,,2/24/05,Uncommon; only on one small steep roadside slope.,Oak woodland with grassland used for cattle grazing crossed by Arroyo Seco Oso Creek. Assoc. with Lepidium nitidum var. nitidum.,,,,,,,,,,,,,,,United States,California,San Luis Obispo,,"along Huasna Road, c. 5 mi. NE of its junction with Huasna Towship Road (generally east of Arroyo Grande)",,0,,35.15611,-120.33778,,,,,,Collector GPS,,,244,,,,,,,,,1/19/20 17:49,UCR-BPS-161685,3,urn:uuid:f1009520-ad97-4377-beb9-3245d6265176,http://cch2.org/portal/collections/individual/index.php?occid=1580562
1681917,UCR,,,PreservedSpecimen,UCR-BPS-265317,UCR0064002,UCR-265317,Plantae,Tracheophyta,Magnoliopsida,Ranunculales,Papaveraceae,Eschscholzia californica,18097,Cham.,Eschscholzia,californica,,,Jon P. Rebman,"Warren Schmidtmann, G. Kenney",2/24/15,2015,2,24,55,,2/24/15,"Annual, flowers orange-yellow; rare.","Oak woodland with Quercus agrifolia, Malosma laurina, Toxicodendron diversilobum, Salvia apiana, Artemisia californica, Baccharis salicifolia, Platanus racemosa.",,,,,,,,,,,,,,,United States,California,San Diego,,"Camp Pendleton, central portion of Base, India Training Area, north of Basilone Road and east of Roblar Road, along a trail in a canyon bottom. Square: D5",,0,,33.35381,-117.34939,,,,,,Collector GPS,,,130,,,,,,,,,1/19/20 17:50,UCR-BPS-265317,3,urn:uuid:2b529b68-4e6c-492c-a95a-f25c44afee42,http://cch2.org/portal/collections/individual/index.php?occid=1681917
1687558,UCR,,,PreservedSpecimen,UCR-BPS-266848,UCR0063999,UCR-266848,Plantae,Tracheophyta,Magnoliopsida,Ranunculales,Papaveraceae,Eschscholzia californica,18097,Cham.,Eschscholzia,californica,,,Jon P. Rebman,"Warren Schmidtmann, G. Kenney",2/24/15,2015,2,24,55,,2/24/15,"Annual, flowers yellow; common.","Rocky slope, coastal sage scrub/oak woodland with Quercus agrifolia, Artemisia californica, Malosma laurina, Diplacus puniceus, Toxicodendron diversilobum Antirrhinum nuttallianum.",,,,,,,,,,,,,,,United States,California,San Diego,,"Camp Penleton, east-central portion of Base, India Training Area, north of Lake O-Neill, east of the Santa Margarita, slope just east of De Luz Road along the Fallbrook Weapons Station border. Square: D6",,0,,33.36231,-117.314,,,,,,Collector GPS,,,105,,,,,,,,,1/19/20 17:50,UCR-BPS-266848,3,urn:uuid:1a03c348-ca7a-4850-a821-f092dc388b94,http://cch2.org/portal/collections/individual/index.php?occid=1687558
2036223,CHSC,VascularPlants,,PreservedSpecimen,c31d5dba-ee53-47a5-9f12-d051e825a4a1,CHSC022755,,Plantae,Tracheophyta,Magnoliopsida,Ranunculales,Papaveraceae,Eschscholzia californica,18097,Cham.,Eschscholzia,californica,,,Robert A. Schlising,,2/24/62,1962,2,24,55,,2/24/62,,Found with other weeds.,,,,,,,,,,,,,,,United States,California,San Mateo,,"the California Coastal Ranges. Roadside, along Cabrillo Hwy (No 1) .7 mi N of county line.",,0,,37.113889,-122.300556,NAD83,402,37§ 6m 50s N; 122§ 18m 2s W,Bill Carlson,,,,,,,,,,,,,,2/7/19 18:49,,44,urn:uuid:c31d5dba-ee53-47a5-9f12-d051e825a4a1,http://cch2.org/portal/collections/individual/index.php?occid=2036223
3363825,UCJEPS,,,PreservedSpecimen,28799ab4-f96f-4cdf-93da-8270b3f82d28,JEPS75473,,Plantae,Tracheophyta,Magnoliopsida,Ranunculales,Papaveraceae,Eschscholzia californica,18097,Cham.,Eschscholzia,californica,,,P. F. Yorks,,2/24/74,1974,2,24,55,,Feb 24 1974,,"grassy sw to w-facing slopes, soil sandstone-derived, loose clay-loam",,"petals orange, stamens orange",,,,,,Flowering/Fruiting,,,,,,,United States,California,Contra Costa,,ca 2 km s Bear Creek Road (n of Briones Reservoir); Hampton Road Natural Reserve,,0,,37.94055,-122.202866,NAD27,335,,,,"Terrain Navigator Pro 1:24,000",,,200,,,,,200 m,,,,5/29/12 16:41,28799ab4-f96f-4cdf-93da-8270b3f82d28,46,urn:uuid:07d99b13-287a-4868-a369-01eb064fe198,http://cch2.org/portal/collections/individual/index.php?occid=3363825
75967,SBBG,,,PreservedSpecimen,571fd7e5-52b3-4bcf-bec1-8f69a126fc49,SBBG168557,38709,Plantae,Tracheophyta,Magnoliopsida,Ranunculales,Papaveraceae,Eschscholzia californica,18097,Cham.,Eschscholzia,californica,,,Reid Moran,,2/25/41,1941,2,25,56,,2/25/41,,banks,,,,,,,,Flowers Present,,,,,,,United States,California,Los Angeles,,Santa Catalina Island: N of Johnson's Valley,,0,,33.4725,-118.5382,NAD83,500,,,,MyTopo,,,100,,,,,,,,,9/25/18 1:01,,16,urn:uuid:f6eb931b-1f4f-46e9-a305-1f8f1b01e8ed,http://cch2.org/portal/collections/individual/index.php?occid=75967
183132,OBI,,,PreservedSpecimen,2c0af842-5596-4f66-8222-2133d5a46527,OBI103902,6964,Plantae,Tracheophyta,Magnoliopsida,Ranunculales,Papaveraceae,Eschscholzia californica,18097,Cham.,Eschscholzia,californica,,,Gerry Uenaka,,2/25/74,1974,2,25,56,,25-Feb-74,,On flat plateau. Soil sandy moist and in full sun. Area was frequently foggy,,Low perennial wit light grey-green foliage and bright yellow fl,,,,,,,,,,,,,United States,California,San Luis Obispo,,400 yds Inland from the cable landing at Montana de Oro State park,,0,,,,,,,,,,,,24,,,,,80ft.,,,,7/18/13 0:00,,12,urn:uuid:cdf6ff4e-67c0-407e-86c9-101b5ba56ac4,http://cch2.org/portal/collections/individual/index.php?occid=183132
240204,UCSC,,,PreservedSpecimen,d2ec0a52-1cb2-40bb-b374-1c710d969e65,,,Plantae,Tracheophyta,Magnoliopsida,Ranunculales,Papaveraceae,Eschscholzia californica,18097,Cham.,Eschscholzia,californica,,,Serena D. Galindo,,2/25/18,2018,2,25,56,,25-Feb-18,,Grassland,,"Bright orange petals and latex, dissected leaves, conical cap,",,,,,Raphanus raphanistrum,,,,,,,,United States,California,Santa Cruz,Santa Cruz,"200m SE of ARC Center of UCSC, Santa Cruz",,0,,36.994147,-122.057542,WGS84,,,,,iNaturalist,,,190,,,,,,,,,3/1/18 14:23,,13,urn:uuid:eac71a65-5119-4fef-a38d-efbc052e32fa,http://cch2.org/portal/collections/individual/index.php?occid=240204
240404,UCSC,,,PreservedSpecimen,98bdb74d-b716-40a5-8980-929d167894b7,,,Plantae,Tracheophyta,Magnoliopsida,Ranunculales,Papaveraceae,Eschscholzia californica,18097,Cham.,Eschscholzia,californica,,,Serena D. Galindo,,2/25/18,2018,2,25,56,,25-Feb-18,,Grassland,,"Bright orange petals and latex, dissected leaves, conical cap,",,,,,Raphanus raphanistrum,,,,,,,,United States,California,Santa Cruz,Santa Cruz,"200m SE of ARC Center of UCSC, Santa Cruz",,0,,36.994147,-122.057542,WGS84,,,,,iNaturalist,,,190,,,,,,,,,3/1/18 20:39,,13,urn:uuid:b32a9b28-d3ad-414e-bffc-9e875e1240d5,http://cch2.org/portal/collections/individual/index.php?occid=240404
519236,SD,,,PreservedSpecimen,{81867AF1-41DC-4153-B3F0-3882995D1D09},SD00032137,SD180173,Plantae,Tracheophyta,Magnoliopsida,Ranunculales,Papaveraceae,Eschscholzia californica,18097,Cham.,Eschscholzia,californica,,,Judy Carlstrom,,2/25/05,2005,2,25,56,,25-Feb-05,,"Linda Vista Formation, red sandy soil.",,"Eight inches, not yet open.",,,,,coastal sage scrub,FL,,,,,,,United States,California,San Diego,,"Poway. East facing slope, near top of hill, above cul de sac at end of Meadowbrook Lane, W of Meadowbrook Middle School, W of Pomerado Rd.",,0,,32.9619,-117.0664,WGS84,,,n/a,,Coordinates from label,,,205,,,,,,,,,1/15/20 10:58,SD180173,43,urn:uuid:36aa0d55-6fed-43f3-aff2-7b76615fcb4f,http://cch2.org/portal/collections/individual/index.php?occid=519236
967364,RSA,RSA,,PreservedSpecimen,78f7266c-52b5-46fe-b903-0aa370714b70,,213369,Plantae,Tracheophyta,Magnoliopsida,Ranunculales,Papaveraceae,Eschscholzia californica,18097,Cham.,Eschscholzia,californica,,,Reid V. Moran,,2/25/41,1941,2,25,56,,2/25/41,,Grassy bank,,,,,,,,,,,flowers,,,Herbarium sheet - 1,United States,California,Los Angeles County,,"Above sea, N of Wilson's Harbor, Santa Catalina Island",,0,,,,,,,,,,,,100,,,,,,,,,9/21/18 11:35,18354101,17,urn:uuid:9c74920e-9465-4873-88ea-878f3f8e0127,http://cch2.org/portal/collections/individual/index.php?occid=967364
1011367,RSA,RSA,,PreservedSpecimen,8dd294a8-0892-4304-a594-bd7333afe09d,,15683,Plantae,Tracheophyta,Magnoliopsida,Ranunculales,Papaveraceae,Eschscholzia californica,18097,Cham.,Eschscholzia,californica,,,Carl B. Wolf,,2/25/28,1928,2,25,56,,2/25/28,,,,,,,,,,,,,flowers,,,Herbarium sheet - 1,United States,California,Napa County,,"Mt. St. Helena Grade, 2 mi. below Hawkins Mt. Camp.",,0,,,,,,,,,,,,,,,,,,,,,9/21/18 11:30,18625710,17,urn:uuid:3f542cab-a778-4b0a-a4da-ab480476df64,http://cch2.org/portal/collections/individual/index.php?occid=1011367
239970,UCSC,,,PreservedSpecimen,852b57f9-9840-498e-8599-fc1714bd7f14,,,,,,,Popaveraceae,Eschscholzia californica,18097,Cham.,Eschscholzia,californica,,,Eric I. Medina,,2/26/18,2018,2,26,57,,26-Feb-18,,Grassland,,"Flower is short and common in grasslands towards the base of UCSC campus. Petals are soft, fleshy, and a bright orange and yellow color. Flowers are often found closed up.",,,,,"Oxalis pew-caprae, Plantago lanceolata, Raphanus raphanistrum",,,,,,,,United States,California,Santa Cruz,Santa Cruz,USA: CA: Santa Cruz Co: Santa Cruz: UCSC: North side of Village Rd.: ~25 m from Hagar Dr.,,0,,36.98572794,-122.0540061,WGS84,,,,,iNaturalist,,,111,,,,,~364 feet,,,,3/1/18 14:23,,13,urn:uuid:148d4d16-626b-4a92-9f1d-2b9f1e6e8e42,http://cch2.org/portal/collections/individual/index.php?occid=239970
240251,UCSC,,,PreservedSpecimen,8194843d-5631-4df3-b1e3-853677e4ef7d,,,Plantae,Tracheophyta,Magnoliopsida,Ranunculales,Papaveraceae,Eschscholzia californica,18097,Cham.,Eschscholzia,californica,,,"William ""Cactus"" Yates",,2/26/18,2018,2,26,57,,26-Feb-18,,Grassland,,Papaveraceae growing in clumps 1-3 m apart in tall annual grasses. On a very gentle slope.,,,,,"annual grasses, brassicaceae, Baccharis pilularis.",,,,,,,,United States,California,Santa Cruz,Santa Cruz,"UCSC, 50 m north of UCSC Farm.",,0,,36.983743,-122.054973,WGS84,,,,,iNaturalist,,,101,,,,,,,,,3/1/18 14:23,,13,urn:uuid:95c4e0be-d0e6-4ff0-84a1-0e4dc537cd84,http://cch2.org/portal/collections/individual/index.php?occid=240251
240451,UCSC,,,PreservedSpecimen,d3175d61-b0d2-4fb0-824b-c167518e392d,,,Plantae,Tracheophyta,Magnoliopsida,Ranunculales,Papaveraceae,Eschscholzia californica,18097,Cham.,Eschscholzia,californica,,,"William ""Cactus"" Yates",,2/26/18,2018,2,26,57,,26-Feb-18,,Grassland,,Papaveraceae growing in clumps 1-3 m apart in tall annual grasses. On a very gentle slope.,,,,,"annual grasses, brassicaceae, Baccharis pilularis.",,,,,,,,United States,California,Santa Cruz,Santa Cruz,"UCSC, 50 m north of UCSC Farm.",,0,,36.983743,-122.054973,WGS84,,,,,iNaturalist,,,101,,,,,,,,,3/1/18 20:39,,13,urn:uuid:1cde9ef4-17b8-4bcd-abc8-efff9c92d261,http://cch2.org/portal/collections/individual/index.php?occid=240451
519079,SD,,,PreservedSpecimen,{3006E6C8-2E43-4F2D-9A38-A5FB62223B97},SD00032925,SD85981,Plantae,Tracheophyta,Magnoliopsida,Ranunculales,Papaveraceae,Eschscholzia californica subsp. peninsularis,,,,,,,R. Mitchel Beauchamp,R.C. Pierce,2/26/71,1971,2,26,57,,26-Feb-71,,,,Annual; flowers orange.,,,,,,FFL,,,,,,,United States,California,San Diego,,"Sunny slope near canyon west of Salk Institute, La Jolla.",,0,,32.88682,-117.25076,WGS84,322,,mak,,TOPO! v3.4.2,,,90,,,,,,,,,1/15/20 10:56,SD85981,43,urn:uuid:8a8f5588-c35f-41cd-b89b-420fc2e97ef2,http://cch2.org/portal/collections/individual/index.php?occid=519079
519243,SD,,,PreservedSpecimen,{64967637-0D6F-4F8C-A71E-3441143E338E},SD00032145,SD184407,Plantae,Tracheophyta,Magnoliopsida,Ranunculales,Papaveraceae,Eschscholzia californica,18097,Cham.,Eschscholzia,californica,,,Jon P. Rebman,Jim Rocks and Karen Mabb,2/26/08,2008,2,26,57,,26-Feb-08,,,,"Annual, flowers yellow-orange; uncommon",,,,,"Coastal Sage Scrub with Malosma laurina, Brassica nigra, Silybum marianum, Artemisia californica, Rhus integrifolia, Baccharis pilularis, and Quercus agrifolia in canyon bottom. Area burned in 2007.",FFL,,,,,,,United States,California,San Diego,,"Camp Pendleton Marine Corps Base: Training Area Romeo 1 in the northwestern portion of base; San Onofre Mountains, along Horno Canyon Road",,0,,33.35917,-117.47361,WGS84,,,n/a,,Coordinates from label,,,220,,,,,,,,,1/15/20 10:58,SD184407,43,urn:uuid:5b8dfed0-052f-47d8-97f0-10aeab714000,http://cch2.org/portal/collections/individual/index.php?occid=519243
519244,SD,,,PreservedSpecimen,{90A66BA4-93ED-4E68-83D3-B42DB8E9A83B},SD00032144,SD184408,Plantae,Tracheophyta,Magnoliopsida,Ranunculales,Papaveraceae,Eschscholzia californica,18097,Cham.,Eschscholzia,californica,,,Jon P. Rebman,Jim Rocks and Karen Mabb,2/26/08,2008,2,26,57,,26-Feb-08,,,,"Annual, flowers yellow-orange; uncommon",,,,,"Coastal Sage Scrub with Malosma laurina, Artemisia californica, Brassica nigra, Dichelostemma capitatum, Cneoridium dumosum, Caulanthus heterophyllus var. pseudosimulans, and Marah macrocarpus. Area burned in 2007.",FFL,,,,,,,United States,California,San Diego,,"Camp Pendleton Marine Corps Base: Training Area Romeo 2 in the northwestern portion of base; coastal side of San Onofre Mountains, along Skyline Road towards the towers on top of San Onofre Mountain",,0,,33.34972,-117.50972,WGS84,,,n/a,,Coordinates from label,,,200,,,,,,,,,1/15/20 10:58,SD184408,43,urn:uuid:97a98756-6563-44ce-88d6-7fdacef441ff,http://cch2.org/portal/collections/individual/index.php?occid=519244
519245,SD,,,PreservedSpecimen,{9D4EC14B-D6AD-4C62-833C-81F6EB5A22A6},SD00032143,SD184409,Plantae,Tracheophyta,Magnoliopsida,Ranunculales,Papaveraceae,Eschscholzia californica,18097,Cham.,Eschscholzia,californica,,,Jon P. Rebman,Jim Rocks and Karen Mabb,2/26/08,2008,2,26,57,,26-Feb-08,,,,"Annual, flowers yellow-orange; rare",,,,,"Coastal Sage Scrub with Malosma laurina, Brassica nigra, Dichelostemma capitatum, Erodium spp., and Marah macrocarpus. Area burned in 2007.",FFL,,,,,,,United States,California,San Diego,,"Camp Pendleton Marine Corps Base: Training Area Romeo 2 in the northwestern portion of base; coastal side of San Onofre Mountains, along Horno Canyon Road",,0,,33.33556,-117.49028,WGS84,,,n/a,,Coordinates from label,,,55,,,,,,,,,1/15/20 10:58,SD184409,43,urn:uuid:91846a73-e2f9-4ac1-a839-7374ec68c59c,http://cch2.org/portal/collections/individual/index.php?occid=519245
317819,UCSB,,UCSB,PreservedSpecimen,07aa1faa-0eb0-4d26-a269-f06a04e4e091,UCSB008999,9463,Plantae,Tracheophyta,Magnoliopsida,Ranunculales,Papaveraceae,Eschscholzia californica,18097,Cham.,Eschscholzia,californica,,,"Lloyd, Robert",,2/27/59,1959,2,27,58,,,,"Chaparral vegetation, south slope, sediment soil",,,,,,,,,,,,,,Sheet - 1,United States,California,Los Angeles,,"1.5 miles below dam in San Dimas Canyon, north side of San Dimas Canyon Rd. in San Gabriel mt. range",,0,,,,,,,,,,,,,,,,,,,,,7/3/14 12:34,,35,urn:uuid:2efd19ad-af83-4999-9829-59a58205d62f,http://cch2.org/portal/collections/individual/index.php?occid=317819
317867,UCSB,,UCSB,PreservedSpecimen,8ed91357-21d7-48de-8468-375513b2bce1,UCSB009052,7044,Plantae,Tracheophyta,Magnoliopsida,Ranunculales,Papaveraceae,Eschscholzia californica,18097,Cham.,Eschscholzia,californica,,,"Gill, Robert",,2/27/59,1959,2,27,58,,,,"Sandy loam soil, chaparral, no slope",,,,,,,,,,,,,,Sheet - 1,United States,California,Los Angeles,,"Along road close to Throne Ranch, lower San Dimas Canyon, San Gabriel Mountain Range",,0,,,,,,,,,,,,,,,,,,,,,7/3/14 12:35,,35,urn:uuid:acd8be9c-bd11-4da4-b5c8-5c85281f9670,http://cch2.org/portal/collections/individual/index.php?occid=317867
519073,SD,,,PreservedSpecimen,{5C36D37F-37AE-4BAC-8FBB-5AD9A16D9180},SD00032867,SD83571,Plantae,Tracheophyta,Magnoliopsida,Ranunculales,Papaveraceae,Eschscholzia californica subsp. peninsularis,,,,,,,R. Mitchel Beauchamp,R.C. Pierce,2/27/71,1971,2,27,58,,27-Feb-71,,,,Annual; flowers orange.,,,,,,FFL,,,,,,,United States,California,San Diego,,"Forming large stands on burned slope, 2.5 miles east of Steele Canyon Bridge, Steele Canyon.",,0,,32.71667,-116.88333,WGS84,,,n/a,,Coordinates from label,,,245,,,,,,,,,1/15/20 10:56,SD83571,43,urn:uuid:418a3499-e195-428b-a2db-5b7f1f3045bd,http://cch2.org/portal/collections/individual/index.php?occid=519073
786715,RSA,RSA,,PreservedSpecimen,46b3a4c3-9745-4e93-b329-7ff6546e5db1,,652112,Plantae,Tracheophyta,Magnoliopsida,Ranunculales,Papaveraceae,Eschscholzia californica,18097,Cham.,Eschscholzia,californica,,,Wm. Guasti,,2/27/48,1948,2,27,58,,2/27/48,,,,,,,,,,,,,flowers,,,Herbarium sheet - 1,United States,California,Los Angeles County,,Located 4 1/2 miles north east of Canoga Park.,,0,,34.234468,-118.541195,,,,,,,,"[33.1333333333333, -115.641666666667 are bad coordinates. Better coordinates are 34.234468N, -118.541195W]",351,,,,,,,,,9/21/18 11:35,18684474,17,urn:uuid:85ec1926-d421-4f6d-9aed-060cf09c8f88,http://cch2.org/portal/collections/individual/index.php?occid=786715
1075830,RSA,POM,,PreservedSpecimen,aca6bb5e-6b73-477b-a5fe-764a58f11b85,,125701,Plantae,Tracheophyta,Magnoliopsida,Ranunculales,Papaveraceae,Eschscholzia californica,18097,Cham.,Eschscholzia,californica,,,Marcus E. Jones,,1882-02-27,1882,2,27,58,,1882-2-27,,,,,,,,,,,,,flowers,,,Herbarium sheet - 1,United States,California,Los Angeles County,,Pasadena.,,0,,,,,,,,,,,,,,,,,,,,,9/21/18 11:30,18417974,17,urn:uuid:1b10e355-4b86-45d3-91b7-9da089cf424e,http://cch2.org/portal/collections/individual/index.php?occid=1075830
3384234,UCJEPS,,,PreservedSpecimen,07a3f663-097d-479d-998f-214ddcc65b4e,UC855135,,Plantae,Tracheophyta,Magnoliopsida,Ranunculales,Papaveraceae,Eschscholzia californica,18097,Cham.,Eschscholzia,californica,,,Marcus E. Jones,,1882-02-27,1882,2,27,58,,Feb 27 1882,county supplied by Wetherwax,,,,,,,,,Flowering/Fruiting,,,,,,,United States,California,Los Angeles,,Pasadena,,0,,34.152867,-118.121454,WGS84,6700,,Rancho Santa Ana (no. 7),,GEOLocate,,georef from 2006-2015 archive backup file; Wed Mar 5 09:10:22 2014; (copied from A343463),,,,,,,,,,5/31/12 22:51,07a3f663-097d-479d-998f-214ddcc65b4e,46,urn:uuid:2cad8a2f-ccaf-48dc-9257-13a2ec59e33c,http://cch2.org/portal/collections/individual/index.php?occid=3384234
